date,review,score,month,day,tfidf_features
2018-04-23,A powerhouse film that brings superheroes to life in a way that could only be imagined in the pages of comic books before it.,4.0,2018-04,23,"be:0.22, before:0.29, brings:0.34, comic:0.26, could:0.27, film:0.17, in:0.31, it:0.13, life:0.36, of:0.12, only:0.27, superheroes:0.27, that:0.31, the:0.09, to:0.13, way:0.24"
2018-04-23,"The very first big team up superheroes in a movie like this, and they nailed it, and it still holds up really well 6 years later. The characters have great chemistry and really feel like an actual team, the acting is perfect in every sense of the word, the action is great, and... yeah, theres really not much else I can say. While its almost guaranteed to be surpased by infinity war (which the reason I decided to watch this again is because infinity war is literally right around the corner at the time I'm typing this) its still a great superhero that is absolutely worth watching if you somehow haven't already.",4.0,2018-04,23,"absolutely:0.12, acting:0.11, action:0.06, again:0.11, almost:0.13, an:0.07, and:0.16, around:0.12, at:0.08, be:0.08, because:0.11, big:0.10, by:0.10, can:0.09, characters:0.07, chemistry:0.11, else:0.13, every:0.10, feel:0.11, first:0.07, great:0.18, have:0.08, holds:0.14, if:0.09, in:0.11, infinity:0.25, is:0.24, it:0.10, its:0.18, later:0.13, like:0.17, movie:0.04, much:0.09, not:0.08, of:0.04, perfect:0.10, really:0.25, reason:0.13, right:0.12, say:0.11, still:0.17, superhero:0.07, superheroes:0.10, team:0.16, that:0.06, the:0.27, they:0.08, this:0.14, time:0.07, to:0.10, up:0.14, very:0.08, war:0.25, watch:0.10, watching:0.11, well:0.08, which:0.10, while:0.11, worth:0.12, years:0.12, you:0.08"
2018-04-23,This is everything that a superhero movie should be. They really struck gold with this one. Then just copied the formula for all the Marvel movies after it.,4.5,2018-04,23,"after:0.31, all:0.17, be:0.22, everything:0.29, for:0.16, is:0.13, it:0.13, just:0.23, marvel:0.17, movie:0.12, movies:0.20, one:0.17, really:0.23, should:0.34, superhero:0.20, that:0.16, the:0.19, then:0.31, they:0.23, this:0.26, with:0.18"
2018-04-17,Best superhero crossover movie ever!,5.0,2018-04,17,"best:0.36, crossover:0.67, ever:0.47, movie:0.23, superhero:0.39"
2018-04-12,"One of my favorite movies of  all time and one of the best movies, period.",5.0,2018-04,12,"all:0.21, and:0.14, best:0.23, favorite:0.35, movies:0.49, my:0.28, of:0.45, one:0.41, the:0.12, time:0.25"
2018-04-10,Dopest Movie!! Fight Scenes are good! Plot were excellent! The only thing I hate is that they killed off Agent Phil Coulson. I which he could've been part of the other MCU moives.,5.0,2018-04,10,"are:0.18, been:0.22, could:0.23, excellent:0.26, fight:0.24, good:0.16, he:0.23, is:0.11, mcu:0.17, movie:0.09, of:0.10, off:0.23, only:0.22, other:0.22, part:0.26, plot:0.22, scenes:0.22, that:0.13, the:0.15, they:0.18, thing:0.26, ve:0.24, were:0.22, which:0.23"
2018-04-04,"This was everything we've been waiting to see plus more. Since they rolled out the first Iron Man in 08 they have been building towards this movie this moment and in my opinion it was better then anyone could ever imagine  that it would be, This is the best  comic book movie that is out right now(with the age of Ultron super close to being better).The storyline was great the look of the film can't be touch even though it was most of it was cgi. The action was just outta of hand great.Infinity wars is less then a month away and from the trailer its looks to be good but I will say that the first Avenger set the bar very high.",5.0,2018-04,4,"action:0.06, age:0.12, and:0.07, avenger:0.12, away:0.12, bar:0.12, be:0.21, been:0.18, being:0.10, best:0.06, better:0.17, book:0.09, building:0.12, but:0.06, can:0.08, cgi:0.10, comic:0.08, could:0.09, even:0.09, ever:0.08, everything:0.09, film:0.06, first:0.13, from:0.07, good:0.06, great:0.11, have:0.07, high:0.12, in:0.10, infinity:0.11, iron:0.09, is:0.13, it:0.17, its:0.08, just:0.07, less:0.12, look:0.12, man:0.09, moment:0.11, more:0.08, most:0.08, movie:0.08, my:0.07, now:0.10, of:0.15, opinion:0.12, out:0.15, right:0.11, say:0.10, see:0.08, set:0.09, since:0.11, storyline:0.11, super:0.09, that:0.15, the:0.30, then:0.20, they:0.14, this:0.17, though:0.10, to:0.13, ve:0.10, very:0.08, was:0.33, we:0.09, will:0.09, with:0.06, would:0.09"
2018-04-03,This is where we knew that we were just begieing our inrcidable MCU adventure!,4.5,2018-04,3,"adventure:0.39, is:0.14, just:0.24, mcu:0.22, our:0.34, that:0.17, this:0.14, we:0.59, were:0.29, where:0.35"
2018-04-02,"What a fantastic movie, from start to finish. What a thrill",5.0,2018-04,2,"fantastic:0.38, finish:0.46, from:0.30, movie:0.15, start:0.38, to:0.17, what:0.60"
2018-03-31,This seemed like a TV movie. I lost all love for Marvel movies because of this. I can't wait for a reboot.,1.0,2018-03,31,"all:0.22, because:0.41, can:0.32, for:0.43, like:0.31, love:0.34, marvel:0.23, movie:0.16, movies:0.26, of:0.16, this:0.34"
2018-03-31,Excellent. Great action. Great graphics. Great acting!!,5.0,2018-03,31,"acting:0.43, action:0.25, excellent:0.46, great:0.73"
2018-03-25,"Overall, I loved this film when I first saw it nearly 4 years ago, and love it possibly even more now! It is a brilliant film, and really fives us all a taste of whats next to come in the Marvel Cinematic Universe. Because of this, I am giving the film a 8.5/10.",4.0,2018-03,25,"10:0.19, all:0.11, and:0.15, because:0.20, brilliant:0.25, cinematic:0.20, come:0.19, even:0.18, film:0.34, first:0.13, in:0.10, is:0.09, it:0.26, love:0.17, loved:0.20, marvel:0.11, more:0.16, now:0.20, of:0.16, overall:0.20, really:0.15, saw:0.22, the:0.12, this:0.17, to:0.09, universe:0.19, us:0.21, when:0.17, years:0.22"
2018-03-24,"A movie with almost no flaws from the great chemistry between all the leads, the story, the villain while also being lighthearted all at the same time. Flawless. 100/100,",5.0,2018-03,24,"all:0.28, almost:0.30, also:0.23, at:0.19, being:0.25, between:0.26, chemistry:0.26, from:0.19, great:0.14, movie:0.10, no:0.24, same:0.27, story:0.20, the:0.39, time:0.16, villain:0.21, while:0.26, with:0.15"
2018-03-24,Very interesting and classic actionmovie by marvel. loved it,5.0,2018-03,24,"and:0.16, by:0.39, classic:0.44, interesting:0.47, it:0.19, loved:0.44, marvel:0.25, very:0.34"
2018-03-23,"An excellent made Marvel film, that will never be forgotten.",4.0,2018-03,23,"an:0.28, be:0.30, excellent:0.45, film:0.24, made:0.38, marvel:0.24, never:0.41, that:0.22, will:0.38"
2018-03-22,"Awesometacular, probably the best superhero movie of all time",5.0,2018-03,22,"all:0.31, best:0.33, movie:0.22, of:0.22, probably:0.64, superhero:0.36, the:0.17, time:0.36"
2018-03-22,Amazing! This movie is the BEST!!!,5.0,2018-03,22,"amazing:0.60, best:0.48, is:0.35, movie:0.31, the:0.25, this:0.35"
2018-03-20,Great Mix of comedy and action that can really make anyone happy,5.0,2018-03,20,"action:0.27, and:0.17, can:0.38, comedy:0.53, great:0.26, make:0.43, of:0.18, really:0.36, that:0.24"
2018-03-19,Great way to finish phase 1!,5.0,2018-03,19,"finish:0.64, great:0.30, phase:0.51, to:0.24, way:0.44"
2018-03-17,"Cookie cutter film making at its most mediocre.  Same old same old heroes versus villains who want to take over the world story that's been done over and over again to death.

I guess the dull masses don't mind seeing the same tired story again because this time, OMG, it's the Avengers!!

Aliens attack Earth en masse, but are repelled by a group of 6 exclusively white people, 2 of whom don't even have super powers (or a super suit).  LOL.",2.5,2018-03,17,"again:0.25, and:0.04, are:0.08, at:0.09, avengers:0.06, because:0.12, been:0.11, but:0.07, by:0.10, death:0.15, don:0.24, done:0.11, earth:0.13, en:0.14, even:0.10, film:0.07, group:0.14, have:0.09, heroes:0.09, it:0.05, its:0.10, making:0.13, mind:0.14, most:0.10, of:0.09, old:0.29, or:0.11, over:0.39, people:0.11, same:0.39, seeing:0.12, story:0.19, super:0.23, take:0.14, that:0.06, the:0.15, this:0.05, time:0.08, to:0.10, villains:0.14, want:0.14, who:0.11, world:0.12"
2018-03-16,An epic and well constructed crossover event.,5.0,2018-03,16,"an:0.36, and:0.20, crossover:0.62, epic:0.52, well:0.41"
2018-03-13,Reigns Supreme as the best Marvel movie,5.0,2018-03,13,"as:0.58, best:0.51, marvel:0.48, movie:0.33, the:0.26"
2018-03-12,Great superhero film,4.0,2018-03,12,"film:0.55, great:0.54, superhero:0.63"
2018-03-11,I have a soft spot for team-up movies and this one had a lot of good teamwork action scenes. The Hulk and Thor fiasco is fun. Cap is a boy scout. Tony is a dick. Hawkeye and Black Widow are dead weight team members but still cool at times. Loki was an okay villain posing a big threat. It was fun.,3.5,2018-03,11,"action:0.10, an:0.12, and:0.20, are:0.13, at:0.13, big:0.17, black:0.20, but:0.10, cap:0.23, cool:0.19, for:0.10, fun:0.27, good:0.12, had:0.16, have:0.13, hawkeye:0.20, hulk:0.16, is:0.23, it:0.08, loki:0.14, lot:0.18, movies:0.11, of:0.07, one:0.10, scenes:0.16, still:0.14, team:0.27, the:0.06, this:0.08, thor:0.17, threat:0.22, times:0.19, tony:0.21, up:0.12, villain:0.15, was:0.20, widow:0.20"
2018-03-10,"I absolutely LOVE this movie!!! My favorite MCU movie to date and tbh, I don’t think any other movie can pass it. It has a great storyline combined with awesome heroes and LOKI!! Need I say more?",5.0,2018-03,10,"absolutely:0.24, and:0.16, any:0.23, awesome:0.19, can:0.18, date:0.27, don:0.22, favorite:0.20, great:0.12, has:0.17, heroes:0.17, it:0.19, loki:0.17, love:0.18, mcu:0.15, more:0.17, movie:0.26, my:0.16, need:0.27, other:0.20, say:0.23, storyline:0.26, think:0.23, this:0.09, to:0.10, with:0.13"
2018-03-10,the most unexpected move by marvel. it is so well made and synchronized and the the timing of the movie's release was definitely right.  movie itself can feel overwhelming with the number of characters.,4.5,2018-03,10,"and:0.20, by:0.24, can:0.22, characters:0.18, definitely:0.27, feel:0.29, is:0.12, it:0.12, made:0.25, marvel:0.15, most:0.24, movie:0.21, of:0.21, right:0.30, so:0.21, the:0.42, was:0.16, well:0.20, with:0.16"
2018-03-07,To me the best movie in the world period,5.0,2018-03,7,"best:0.34, in:0.29, me:0.50, movie:0.22, the:0.35, to:0.25, world:0.57"
2018-03-04,"The Avengers is amazing, groundbreaking, mighty Marvel entertainment, and is one of the best superhero films to date",5.0,2018-03,4,"amazing:0.30, and:0.15, avengers:0.21, best:0.24, date:0.50, films:0.33, is:0.36, marvel:0.23, of:0.16, one:0.22, superhero:0.27, the:0.25, to:0.18"
2018-03-02,"The Avengers is awesome, funny, action packed, and filled with good humor. The Avengers is awesome!",5.0,2018-03,2,"action:0.17, and:0.11, avengers:0.31, awesome:0.52, filled:0.37, funny:0.31, good:0.20, humor:0.31, is:0.26, packed:0.29, the:0.19, with:0.18"
2018-03-02,i loved it its one of the best superheroes movies marvel has made,5.0,2018-03,2,"best:0.25, has:0.33, it:0.18, its:0.34, loved:0.41, made:0.38, marvel:0.23, movies:0.27, of:0.16, one:0.23, superheroes:0.38, the:0.13"
2018-03-02,By far the best movie I've ever watched.,5.0,2018-03,2,"best:0.25, by:0.37, ever:0.33, far:0.50, movie:0.16, the:0.13, ve:0.41, watched:0.48"
2018-02-26,"My favorite marvel movie ever, everything about this movie is spectacular (except CGI hulk, Coulson’s fake death, and Nick fury being black (not racist, just not like comics)). Loki is a great villain but I definitely think they should have found a way to make him super powerful cause on his own he can’t beat Thor let alone the avengers, even with a random alien race on his side and a mine controlled scientist who has very little impact on this movie as opposed to the first two Thor movies",4.5,2018-02,26,"about:0.12, and:0.10, as:0.09, avengers:0.07, being:0.14, black:0.15, but:0.08, can:0.11, cgi:0.13, comics:0.16, death:0.17, definitely:0.13, even:0.12, ever:0.11, everything:0.13, favorite:0.12, first:0.09, fury:0.16, great:0.08, has:0.11, have:0.10, he:0.13, him:0.15, his:0.27, hulk:0.12, is:0.12, just:0.10, like:0.10, little:0.13, loki:0.10, make:0.12, marvel:0.08, movie:0.16, movies:0.09, my:0.10, nick:0.16, not:0.19, on:0.30, own:0.15, should:0.15, spectacular:0.16, super:0.13, the:0.08, they:0.10, think:0.14, this:0.11, thor:0.25, to:0.12, two:0.15, very:0.10, villain:0.11, way:0.11, who:0.13, with:0.08"
2018-02-24,Always will remember the first time I saw it in theaters will always find a place in my heart.,5.0,2018-02,24,"always:0.53, find:0.28, first:0.16, heart:0.29, in:0.24, it:0.10, my:0.17, remember:0.26, saw:0.26, the:0.07, theaters:0.29, time:0.15, will:0.43"
2018-02-21,"An impressive screenplay allows the audience to become completely invested with characters that are given the right amount of time to be developed. However, despite the blisteringly entertaining action and impressive effects, I don't understand why people believe Loki is such a great villain. He's good for sure, but not the best the MCU has to offer. Doesn't change that this film is about as good as the MCU gets.

A",4.5,2018-02,21,"about:0.14, action:0.09, an:0.10, and:0.06, are:0.11, as:0.21, audience:0.19, be:0.11, become:0.19, best:0.09, but:0.09, characters:0.10, despite:0.19, developed:0.19, doesn:0.17, don:0.16, effects:0.15, entertaining:0.15, film:0.09, for:0.08, gets:0.18, good:0.20, great:0.09, has:0.12, he:0.15, however:0.18, is:0.14, loki:0.12, mcu:0.21, not:0.11, of:0.06, people:0.15, right:0.17, such:0.16, sure:0.16, that:0.16, the:0.29, this:0.07, time:0.10, to:0.20, understand:0.19, villain:0.13, why:0.18, with:0.09"
2018-02-19,"Do I even need to say anything besides; ""pure fun""?",5.0,2018-02,19,"anything:0.42, do:0.34, even:0.31, fun:0.27, need:0.43, pure:0.43, say:0.37, to:0.16"
2018-02-17,"Bringing together earth's mightiest heroes into one movie was almost guaranteed to be a smash success, and The Avengers manages to succeed on every level imaginable
 I'll give it 
         - 93%",4.5,2018-02,17,"almost:0.30, and:0.09, avengers:0.13, be:0.18, bringing:0.27, earth:0.28, every:0.23, give:0.26, heroes:0.20, into:0.24, it:0.11, level:0.32, ll:0.30, mightiest:0.31, movie:0.10, on:0.19, one:0.14, the:0.08, to:0.22, together:0.18, was:0.15"
2018-02-17,Una de las mejores películas de superhéroes tiene buenos efectos especiales un gran villano y muy importante un guion que no aburre,4.5,2018-02,17,"de:0.55, no:0.26, que:0.30, un:0.66, una:0.33"
2018-02-16,This seriously is one of the greatest superhero films ever made.,5.0,2018-02,16,"ever:0.38, films:0.38, greatest:0.47, is:0.21, made:0.43, of:0.19, one:0.26, superhero:0.31, the:0.15, this:0.20"
2018-02-15,"One of Marvels Best flims! Amazing Script. Amazing cast and its superheros set pieces, This is a Amazing Unite Avengers Flim",5.0,2018-02,15,"amazing:0.62, and:0.10, avengers:0.14, best:0.17, cast:0.25, is:0.12, its:0.23, marvels:0.33, of:0.11, one:0.15, pieces:0.34, script:0.30, set:0.27, this:0.12"
2018-02-14,"Considered a modern classic by many, 'The Avengers' might be the most important comic book movie to date, and it's surely gained the love it's been receiving since its release date back in 2012. The cast is perfect, the plot is exciting and the overall feeling of the movie couldn't be more satisfying. It is Marvel's biggest piece of art. Amazing.",5.0,2018-02,14,"2012:0.17, amazing:0.12, and:0.12, avengers:0.08, back:0.16, be:0.23, been:0.14, book:0.14, by:0.14, cast:0.14, classic:0.16, comic:0.14, couldn:0.18, date:0.39, exciting:0.18, in:0.08, is:0.21, it:0.21, its:0.13, love:0.13, many:0.15, marvel:0.09, might:0.20, modern:0.20, more:0.13, most:0.14, movie:0.12, of:0.12, overall:0.16, perfect:0.14, plot:0.14, since:0.17, the:0.34, to:0.07"
2018-02-14,The best superhero film I have ever seen! Delivers without fail on all fronts. ✓,5.0,2018-02,14,"all:0.21, best:0.22, delivers:0.47, ever:0.30, film:0.21, have:0.27, on:0.28, seen:0.37, superhero:0.24, the:0.12, without:0.43"
2018-02-12,all time best superhero movie.,5.0,2018-02,12,"all:0.43, best:0.46, movie:0.30, superhero:0.51, time:0.50"
2018-02-12,"Despite some arbitrary plot points and a slow start, ""The Avengers"" is a creative, exciting, fun film that was definitely worth the wait.",4.5,2018-02,12,"and:0.11, avengers:0.15, definitely:0.29, despite:0.37, exciting:0.34, film:0.17, fun:0.23, is:0.13, plot:0.26, slow:0.35, some:0.25, start:0.29, that:0.15, the:0.18, was:0.17, worth:0.33"
2018-02-12,A revolutionary film that set the standard for superhero films after it. It's excellent story only adds more to these pre-developed characters and entertains nerds and non-nerds alike. It aslo has one of the best villains proving that marvel can have good villains if they try.,5.0,2018-02,12,"after:0.21, and:0.15, best:0.12, can:0.17, characters:0.13, developed:0.26, excellent:0.22, film:0.12, films:0.16, for:0.11, good:0.13, has:0.16, have:0.15, if:0.18, it:0.27, marvel:0.12, more:0.16, of:0.08, one:0.11, only:0.19, set:0.20, story:0.16, superhero:0.13, that:0.21, the:0.13, these:0.18, they:0.15, to:0.09, villains:0.48"
2018-02-11,"The team up of all the marvel heroes that we have been waiting for. In a move that I didn't think would work actually did. All these characters and egos working together seamlessly. Sure, there are flaws and plot holes, but they still work out to make an enjoyable movie going experience. With the Iron man leading up a team of reluctant heroes in order to save the world from Loki and his band of mindless minions. The three main heroes, Iron man, Captain America, and Thor, all shine through. The real surprise though is Hulk. Mark Ruffalo calls in a memorable performance to bring a smile to any comic book fan. His one liners and erratic behavior makes to an enjoyable performance. The one that is held back by the crowded lineup is Hawkeye. Set to be a mindless drone that does Loki's bidding for a majority of the film. This is a real waste of the talent of Jeremy Renner. The man can act with the best of them and he is assigned to a role that is forgettable. The directing style of Joss Whedon is felt for sure. His mannerisms and comedy is felt throughout this film. It feels like Firefly mixed with Buffy. Whitty dialogue mixed with great action set pieces. A must see.",3.5,2018-02,11,"act:0.08, action:0.04, actually:0.08, all:0.12, america:0.07, an:0.09, and:0.18, any:0.07, are:0.05, back:0.07, be:0.05, been:0.06, best:0.04, book:0.06, bring:0.08, but:0.04, by:0.06, can:0.06, captain:0.07, characters:0.05, comedy:0.08, comic:0.06, dialogue:0.08, did:0.07, didn:0.07, does:0.07, enjoyable:0.15, experience:0.07, fan:0.08, feels:0.08, felt:0.16, film:0.08, for:0.11, from:0.05, going:0.08, great:0.04, have:0.05, hawkeye:0.08, he:0.07, heroes:0.17, his:0.21, hulk:0.06, in:0.11, iron:0.13, is:0.24, it:0.03, jeremy:0.09, joss:0.07, like:0.05, loki:0.11, main:0.08, make:0.06, makes:0.07, man:0.19, mark:0.07, marvel:0.04, memorable:0.08, movie:0.03, must:0.07, of:0.22, one:0.08, out:0.06, performance:0.16, pieces:0.08, plot:0.06, real:0.16, renner:0.09, ruffalo:0.07, save:0.09, see:0.06, set:0.13, shine:0.08, still:0.05, sure:0.15, team:0.11, that:0.18, the:0.28, them:0.06, there:0.06, these:0.06, they:0.05, think:0.07, this:0.06, thor:0.07, though:0.07, through:0.09, throughout:0.09, to:0.21, together:0.05, up:0.09, we:0.06, whedon:0.06, with:0.16, work:0.14, world:0.07, would:0.07"
2018-02-10,"One of the greatest superhero movies ever made. This film is undeniably beautiful, from the intriguing villain to the iconic assembly of The Avengers. The music is great with on point acting and a fantastic story. One of the strongest MCU movies, a well deserved 94%.",4.5,2018-02,10,"acting:0.20, and:0.07, avengers:0.11, beautiful:0.26, ever:0.16, fantastic:0.20, film:0.12, from:0.15, great:0.11, greatest:0.20, iconic:0.24, is:0.18, made:0.19, mcu:0.14, movies:0.26, music:0.25, of:0.24, on:0.15, one:0.22, point:0.22, story:0.16, superhero:0.13, the:0.38, this:0.09, to:0.09, villain:0.17, well:0.15, with:0.12"
2018-02-06,the best thing i have ever seen,5.0,2018-02,6,"best:0.31, ever:0.41, have:0.38, seen:0.52, the:0.16, thing:0.55"
2018-02-06,"Title: Avengers
Story/Writing/Message/Plot:	3
Character/Acting:		3
Music/Sound:			1
Cinematography/Editing:	4
Age/Originality:			4
Total:			15/25",3.0,2018-02,6,"acting:0.32, age:0.41, avengers:0.17, character:0.26, cinematography:0.41, music:0.40, plot:0.29, story:0.26, writing:0.39"
2018-02-04,"nice cast, nice plot, and overall kind of a funny version of the classic superhero team",4.0,2018-02,4,"and:0.10, cast:0.25, classic:0.28, funny:0.28, nice:0.71, of:0.22, overall:0.28, plot:0.25, superhero:0.18, team:0.21, the:0.09"
2018-02-03,One Of My Favorite MCU Movies,5.0,2018-02,3,"favorite:0.56, mcu:0.41, movies:0.39, my:0.45, of:0.24, one:0.33"
2018-02-03,"This is the best of the Avengers movies.  The story is excellent (Joss Whedon), and the acting is top-tier from everyone in the movie.",4.5,2018-02,3,"acting:0.27, and:0.10, avengers:0.14, best:0.17, everyone:0.27, excellent:0.29, from:0.21, in:0.14, is:0.36, joss:0.26, movie:0.11, movies:0.18, of:0.11, story:0.22, the:0.43, this:0.12, top:0.28, whedon:0.25"
2018-02-03,"Simply one of the best super hero films of all time.  Must watch action adventure, no one does it better then Marvel Avengers.",5.0,2018-02,3,"action:0.16, adventure:0.32, all:0.15, avengers:0.14, best:0.16, better:0.24, does:0.28, films:0.22, hero:0.27, it:0.12, marvel:0.15, must:0.28, no:0.25, of:0.21, one:0.29, super:0.26, the:0.08, then:0.27, time:0.18, watch:0.24"
2018-02-01,A great beginning story for a team of characters with a great story and amazing actors,5.0,2018-02,1,"actors:0.34, amazing:0.25, and:0.12, beginning:0.41, characters:0.22, for:0.18, great:0.38, of:0.13, story:0.54, team:0.26, with:0.20"
2018-01-26,"Love, love, LOVE!! Great story, awesome characters and actors, and Loki.. need I say more?",5.0,2018-01,26,"actors:0.27, and:0.20, awesome:0.23, characters:0.17, great:0.15, loki:0.21, love:0.68, more:0.21, need:0.33, say:0.28, story:0.21"
2018-01-26,"After some of Marvel's previous movie attempts were big set ups for this movie, Marvel defies all expectations of people saying ""no way a superhero team-up movie could be successful and become the fifth highest grossing movie of all time"". Well they proved the haters wrong and this movie is what turned Marvel into one of the most recognisable studios today. ""Marvel's The Avengers"" is a movie that succeeds in all ways.",4.5,2018-01,26,"after:0.16, all:0.26, and:0.12, avengers:0.08, be:0.11, become:0.19, big:0.15, could:0.15, expectations:0.19, for:0.09, in:0.08, into:0.15, is:0.14, marvel:0.36, most:0.14, movie:0.37, no:0.15, of:0.25, one:0.09, people:0.15, previous:0.18, set:0.15, some:0.13, studios:0.20, superhero:0.10, team:0.12, that:0.08, the:0.20, they:0.12, this:0.14, time:0.10, up:0.10, way:0.13, well:0.12, were:0.14, what:0.12"
2018-01-24,Probably the best superhero movie I've seen to this day. I still get goosebumps from the new york fight scene.,5.0,2018-01,24,"best:0.17, day:0.31, fight:0.27, from:0.21, get:0.26, movie:0.11, new:0.29, probably:0.32, scene:0.30, seen:0.28, still:0.21, superhero:0.18, the:0.17, this:0.12, to:0.12, ve:0.28, york:0.33"
2018-01-14,The avengers are getting ready to work as a team to stop Loki can they do that and save people find out! Just a ok movie,3.0,2018-01,14,"and:0.10, are:0.20, as:0.19, avengers:0.14, can:0.22, do:0.26, find:0.32, just:0.20, loki:0.21, movie:0.11, out:0.22, people:0.26, save:0.33, stop:0.34, team:0.21, that:0.14, the:0.08, they:0.20, to:0.24, work:0.26"
2018-01-07,Best movie I have ever seen.,5.0,2018-01,7,"best:0.37, ever:0.49, have:0.44, movie:0.24, seen:0.61"
2018-01-05,"As ""beginning of the end"", The Avengers is a powerful start. Less fun than others  maybe, but action packed and amazingly well crafted.",3.5,2018-01,5,"action:0.18, and:0.12, as:0.22, avengers:0.17, beginning:0.38, but:0.18, end:0.30, fun:0.24, is:0.14, less:0.39, of:0.12, packed:0.30, start:0.31, than:0.28, the:0.20, well:0.24"
2017-12-31,A movie that soars. one of the best marvel movies. and thats saying something.,5.0,2017-12,31,"and:0.20, best:0.33, marvel:0.31, movie:0.21, movies:0.35, of:0.22, one:0.30, something:0.58, that:0.28, the:0.17"
2017-12-29,"This is an amazing film with a future that will strive and never get old, plus its incredible cast makes this movie 5 stars!",5.0,2017-12,29,"amazing:0.20, an:0.18, and:0.10, cast:0.24, film:0.15, future:0.32, get:0.26, incredible:0.28, is:0.12, its:0.22, makes:0.27, movie:0.10, never:0.27, old:0.33, stars:0.33, that:0.14, this:0.23, will:0.25, with:0.16"
2017-12-29,"Every MCU film raises the bar, both in terms of action and special effects, and in terms of the probing of what it means to be a human hero.

I like that my grandsons enjoy this, especially because it gives us shared entertainment and occasionally shared topics about what a ""hero"" is.",4.5,2017-12,29,"about:0.17, action:0.11, and:0.21, bar:0.23, be:0.14, because:0.19, both:0.24, effects:0.18, enjoy:0.22, especially:0.21, every:0.18, film:0.11, gives:0.23, hero:0.38, in:0.20, is:0.08, it:0.17, like:0.15, mcu:0.13, my:0.14, of:0.22, special:0.20, that:0.10, the:0.12, this:0.08, to:0.08, us:0.20, what:0.29"
