date,review,score,month,day,tfidf_features
2022-02-22,"This may be my favourite stand-alone MCU film. From its interesting characters, threatening villain, hard-hitting action, element of espionage, and of course, heart, ""Captain America: The Winter Soldier"" serves as a more than worth sequel to and for ""The First Avenger"" and a memorable entry into the MCU.",4.5,2022-02,22,"action:0.11, america:0.19, and:0.21, as:0.13, avenger:0.22, be:0.14, captain:0.18, characters:0.12, course:0.24, favourite:0.23, film:0.11, first:0.13, for:0.10, from:0.14, hard:0.22, heart:0.23, interesting:0.20, into:0.18, its:0.15, may:0.22, mcu:0.25, memorable:0.22, more:0.15, my:0.14, of:0.15, stand:0.23, than:0.17, the:0.17, this:0.08, to:0.08, villain:0.16, worth:0.21"
2022-02-16,A really good start to the MCU,4.5,2022-02,16,"good:0.39, mcu:0.41, really:0.46, start:0.59, the:0.19, to:0.27"
2022-01-28,Just perfect and gorgeous!!!,5.0,2022-01,28,"and:0.30, just:0.61, perfect:0.73"
2022-01-27,My rating for the film is a 8.7/10,4.0,2022-01,27,"10:0.61, film:0.38, for:0.35, is:0.29, my:0.48, the:0.20"
2022-01-24,"Loud, tedious, mind-numbing, cartoony. Each superhero had their moment, and I liked the giant flying spiney machine dragon things in the final act, but overall I found The Avengers difficult to follow and the characters unrelatable. Not bad, but overrated.",2.5,2022-01,24,"act:0.25, and:0.17, avengers:0.12, bad:0.24, but:0.26, characters:0.15, each:0.20, final:0.25, had:0.21, in:0.12, liked:0.26, mind:0.27, moment:0.27, not:0.16, overall:0.23, overrated:0.27, superhero:0.15, the:0.28, their:0.19, things:0.27, to:0.10"
2022-01-19,"A great movie that does the modern superhero movie justice, staying true to its comic material with well written characters and story whilst providing extremely well done action scenes that feel grand in scale much like the stories created by Jack Kirby and Stan Lee",4.0,2022-01,19,"action:0.14, and:0.17, by:0.21, characters:0.15, comic:0.20, does:0.25, done:0.22, feel:0.25, great:0.13, in:0.12, its:0.20, like:0.18, modern:0.30, movie:0.18, much:0.20, scenes:0.21, story:0.19, superhero:0.15, that:0.24, the:0.15, to:0.10, true:0.27, well:0.35, with:0.14"
2022-01-15,The Avengers was a great way to combine all of the hard work that marvel studios have done. The character development is such a driving factor for this movie.,5.0,2022-01,15,"all:0.15, avengers:0.15, character:0.22, development:0.32, done:0.26, for:0.15, great:0.16, hard:0.33, have:0.20, is:0.12, marvel:0.16, movie:0.11, of:0.11, studios:0.35, such:0.29, that:0.15, the:0.26, this:0.12, to:0.12, was:0.16, way:0.23, work:0.27"
2022-01-14,"You have no idea how INSANE it was seeing all of the movies and stories that came before it in the MCU tie together. There were definitely better movies, but still really good!",4.0,2022-01,14,"all:0.13, and:0.09, before:0.23, better:0.21, but:0.14, came:0.26, definitely:0.23, good:0.15, have:0.17, how:0.20, idea:0.30, in:0.12, it:0.21, mcu:0.16, movies:0.30, no:0.22, of:0.09, really:0.18, seeing:0.25, still:0.18, that:0.12, the:0.15, there:0.20, together:0.17, was:0.14, were:0.21, you:0.17"
2022-01-11,Epic full of action and chatacters that everyone love.,4.5,2022-01,11,"action:0.26, and:0.17, epic:0.43, everyone:0.44, full:0.54, love:0.38, of:0.18, that:0.24"
2022-01-10,A bit messy at times but still an enjoyable marvel movie,3.5,2022-01,10,"an:0.28, at:0.31, bit:0.42, but:0.24, enjoyable:0.45, marvel:0.24, movie:0.16, still:0.32, times:0.45"
2022-01-06,A classic and still holds up so well to this day.,4.5,2022-01,6,"and:0.14, classic:0.39, day:0.43, holds:0.49, so:0.30, still:0.30, this:0.17, to:0.17, up:0.26, well:0.29"
2022-01-06,"There is not a single superheroe movie with more epic moments than this one, of course there have been bigger blockbusters, but The Avengers makes us connect with the human side of our favorite heroes in such a compelling way that is easy to see why the movie was and continue to be so acclamed.",5.0,2022-01,6,"and:0.07, avengers:0.10, be:0.13, been:0.17, but:0.11, compelling:0.22, course:0.23, epic:0.18, favorite:0.17, have:0.13, heroes:0.15, in:0.10, is:0.16, makes:0.19, moments:0.19, more:0.15, movie:0.14, not:0.13, of:0.14, one:0.10, our:0.19, see:0.15, single:0.23, so:0.14, such:0.19, than:0.16, that:0.10, the:0.17, there:0.31, this:0.08, to:0.16, us:0.19, was:0.11, way:0.15, why:0.21, with:0.22"
2022-01-02,"Somehow a group of less-than-stellar films were then funneled chronologically into a team-up superhero film that broke records and our minds. Besides that, with a clever script and exciting action scenes, what seems like a short ride of a story ends up being fairly impressive. At its lowest, Avengers is still fairly decent.",4.0,2022-01,2,"action:0.12, and:0.15, at:0.15, avengers:0.11, being:0.21, decent:0.26, exciting:0.24, film:0.12, films:0.16, group:0.24, into:0.19, is:0.09, its:0.17, less:0.25, like:0.16, of:0.16, our:0.22, scenes:0.18, script:0.22, still:0.16, story:0.16, superhero:0.13, team:0.15, than:0.18, that:0.21, then:0.21, up:0.27, were:0.18, what:0.16, with:0.12"
2021-12-30,It was a very enjoyable series,4.5,2021-12,30,"enjoyable:0.57, it:0.23, series:0.61, very:0.41, was:0.30"
2021-12-29,1 of the best movies,5.0,2021-12,29,"best:0.59, movies:0.64, of:0.39, the:0.31"
2021-12-28,O melhor filme dos vingadores de todos,5.0,2021-12,28,"de:0.65, filme:0.76"
2021-12-28,"One of my favourite MCU movies was so awesome to see all the hero’s at the time come together even tho some don’t even like each other but come together for the greater good. The score and story was really well done it could’ve been really bad and is easy to mess up with so many characters but I felt everything felt fluent and natural, Tom Hiddleston really shines as does Robert Downey JR",4.5,2021-12,28,"all:0.07, and:0.14, as:0.09, at:0.10, awesome:0.11, bad:0.14, been:0.12, but:0.15, characters:0.09, come:0.25, could:0.12, does:0.14, don:0.13, done:0.12, downey:0.14, each:0.12, even:0.23, everything:0.12, favourite:0.16, felt:0.31, for:0.07, good:0.09, hero:0.13, hiddleston:0.14, is:0.06, it:0.06, jr:0.15, like:0.10, many:0.13, mcu:0.09, movies:0.08, my:0.10, of:0.05, one:0.07, other:0.12, really:0.30, robert:0.14, score:0.16, see:0.11, so:0.20, some:0.11, story:0.10, the:0.16, time:0.09, to:0.12, together:0.18, tom:0.15, up:0.09, ve:0.13, was:0.15, well:0.10, with:0.08"
2021-12-23,Brilliant set up for a brilliant franchise. Directed fantastically.,4.0,2021-12,23,"brilliant:0.83, for:0.18, franchise:0.35, set:0.32, up:0.22"
2021-12-22,"Amazing! 

With this all-star cast, there's nothing that can go wrong.

Avengers, Assemble!!",4.5,2021-12,22,"all:0.18, amazing:0.24, assemble:0.38, avengers:0.17, can:0.26, cast:0.29, go:0.38, nothing:0.36, star:0.39, that:0.17, there:0.27, this:0.14, with:0.19"
2021-12-20,A dream come true for fans now it is a part of cinematic history,5.0,2021-12,20,"cinematic:0.35, come:0.32, fans:0.35, for:0.18, history:0.39, is:0.15, it:0.15, now:0.34, of:0.13, part:0.37, true:0.39"
2021-12-16,"Marvels The Avengers was a movie most comic book fans never thought would occur, and not only did it occur, but it lived up to all the expectations it had on its shoulders. This is a movie that needs to be watched, it is easily still one of my top favorite marvel movies, and it holds up to this day as a great film. While the plot itself is simple, the characters and actions scenes within this movie hold it together and make it a fun movie to watch, even with its dialogue heavy middle. This is a must watch again with Avengers Endgame coming up, as it is the first time these characters were brought together on the big screen. With its importance there, and Endgame being the final send off for Infinity Saga, I would be very surprised if this movie isn't heavily referenced at some point within the film. Go back and watch this film, you won't be disappointed.",5.0,2021-12,16,"again:0.09, all:0.05, and:0.19, as:0.12, at:0.06, avengers:0.09, back:0.09, be:0.18, being:0.09, big:0.08, book:0.07, brought:0.10, but:0.05, characters:0.11, comic:0.07, coming:0.11, day:0.09, dialogue:0.09, did:0.08, endgame:0.20, even:0.07, expectations:0.10, fans:0.09, favorite:0.08, film:0.14, final:0.09, first:0.06, for:0.05, fun:0.06, go:0.10, great:0.05, had:0.08, hold:0.10, holds:0.11, if:0.07, infinity:0.10, is:0.18, isn:0.10, it:0.30, its:0.21, make:0.08, marvel:0.05, marvels:0.10, most:0.07, movie:0.16, movies:0.05, must:0.09, my:0.06, needs:0.11, never:0.08, not:0.06, of:0.03, off:0.08, on:0.13, one:0.05, only:0.08, plot:0.08, point:0.09, scenes:0.07, screen:0.08, some:0.07, still:0.06, that:0.04, the:0.21, there:0.07, these:0.07, this:0.22, thought:0.09, time:0.05, to:0.15, together:0.12, top:0.09, up:0.17, very:0.07, was:0.05, watch:0.23, watched:0.10, were:0.07, while:0.09, with:0.15, would:0.16, you:0.06"
2021-12-14,"First time watching this one in years and it's still a lot of fun.  It was particularly fun seeing all these characters meet each other for the first time, and seeing Loki back when he was a straight villain.  Probably third in the running for Avengers movie behind Infinity War and Endgame, while miles ahead of Avengers 2.",3.5,2021-12,14,"all:0.09, and:0.18, avengers:0.17, back:0.17, characters:0.11, each:0.14, endgame:0.19, first:0.22, for:0.18, fun:0.25, he:0.16, in:0.17, infinity:0.19, it:0.14, loki:0.13, lot:0.16, movie:0.06, of:0.13, one:0.09, other:0.15, probably:0.19, seeing:0.34, still:0.13, the:0.10, these:0.15, third:0.19, this:0.07, time:0.21, villain:0.14, war:0.19, was:0.19, watching:0.16, when:0.14, while:0.17, years:0.18"
2021-12-14,PERFECT!!! MY FAVORITE MOVIE MCU.,5.0,2021-12,14,"favorite:0.55, mcu:0.41, movie:0.23, my:0.44, perfect:0.54"
2021-12-11,"Fucking awesome, a fantastic conclusion to Phase 1. 5/5",5.0,2021-12,11,"awesome:0.52, fantastic:0.58, phase:0.57, to:0.27"
2021-12-03,"The script emphasizes its heroes humanity this lived up to its hype and, in my opinion, took the entire franchise to a new height.  The character development and dialogue were much appreciated.",4.5,2021-12,3,"and:0.17, character:0.18, development:0.26, dialogue:0.25, entire:0.26, franchise:0.24, heroes:0.18, hype:0.27, in:0.12, its:0.38, much:0.20, my:0.17, new:0.24, opinion:0.28, script:0.24, the:0.21, this:0.10, to:0.20, up:0.15, were:0.20"
2021-11-29,Great Movie And Still remains one of the best MCU movies to date,5.0,2021-11,29,"and:0.17, best:0.28, date:0.57, great:0.26, mcu:0.31, movie:0.18, movies:0.30, of:0.18, one:0.25, still:0.36, the:0.14, to:0.20"
2021-11-22,"Best superhero movie.
Ever.",5.0,2021-11,22,"best:0.48, ever:0.63, movie:0.31, superhero:0.52"
2021-11-20,Best Marvel movie of all time.,5.0,2021-11,20,"all:0.42, best:0.46, marvel:0.43, movie:0.30, of:0.30, time:0.50"
2021-11-19,una pelicula que sin duda marco un antes y un despues en el mundo de los superheroes en general....una de las mejores producciones de superheroes de todos los tiempos,5.0,2021-11,19,"de:0.59, el:0.19, en:0.36, los:0.35, que:0.16, superheroes:0.27, un:0.36, una:0.36"
2021-11-15,"One of the better installments of the MCU, ""The Avengers"" was a groundbreaking film that changed cinema forever by bringing together these different heroes for the first time. The entire film from start to finish is a blast and an enjoyment to watch, with very memorable lines and a strong performance from its entire cast. The comedy and banter in this movie lands, and the action, especially in the finale, in done very well.",4.5,2021-11,15,"action:0.08, an:0.09, and:0.21, avengers:0.07, better:0.13, bringing:0.15, by:0.13, cast:0.13, changed:0.18, cinema:0.16, comedy:0.16, different:0.16, done:0.13, entire:0.32, especially:0.16, film:0.16, finish:0.17, first:0.10, for:0.08, from:0.22, heroes:0.11, in:0.22, is:0.06, its:0.12, mcu:0.10, memorable:0.16, movie:0.06, of:0.11, one:0.08, performance:0.17, start:0.14, strong:0.17, that:0.07, the:0.36, these:0.13, this:0.06, time:0.09, to:0.13, together:0.10, very:0.22, was:0.08, watch:0.13, well:0.11, with:0.08"
2021-11-13,"I think we all know how much this movie meant for all the marvel fans and it was truly a new experience. It was great watching the line up between these superhero's and how they work together as a team. The only thing that is bad about this movie are the too many jokes, every 5 minutes comes a joke and it really takes it off a bit.",3.5,2021-11,13,"about:0.14, all:0.17, and:0.17, are:0.11, as:0.10, bad:0.16, between:0.16, bit:0.15, every:0.14, experience:0.16, fans:0.16, for:0.08, great:0.09, how:0.26, is:0.07, it:0.27, jokes:0.19, know:0.17, many:0.15, marvel:0.09, minutes:0.19, movie:0.12, much:0.13, new:0.16, off:0.14, only:0.14, really:0.12, superhero:0.10, takes:0.19, team:0.12, that:0.08, the:0.19, these:0.13, they:0.11, thing:0.16, think:0.16, this:0.13, together:0.11, too:0.13, truly:0.17, up:0.10, was:0.17, watching:0.15, we:0.14, work:0.15"
2021-11-12,Molto molto molto bello,5.0,2021-11,12,
2021-11-11,"In my top 3 MCU movies, the Avengers is witty, tightly-paced, sharp and gripping from start to finish. Balances multiple headliner superheroes deftly in a single movie, all of the heroes being likable, unlike in ""Justice League"". Could not commend any higher.",5.0,2021-11,11,"all:0.13, and:0.09, any:0.24, avengers:0.12, being:0.24, could:0.22, finish:0.28, from:0.18, heroes:0.19, in:0.37, is:0.10, mcu:0.16, movie:0.09, movies:0.15, multiple:0.29, my:0.18, not:0.16, of:0.09, single:0.30, start:0.23, superheroes:0.22, the:0.15, to:0.11, top:0.24"
2021-11-11,It's the first trial of team-up by the studio and it turned out to be a classic one. Really like this film.,4.0,2021-11,11,"and:0.13, be:0.26, by:0.31, classic:0.36, film:0.20, first:0.24, it:0.31, like:0.27, of:0.14, one:0.19, out:0.28, really:0.27, team:0.27, the:0.22, this:0.15, to:0.16, up:0.23"
2021-10-29,The pacing is incredibly dull but the third act is worth the watch. Arguably one of the weakest films in the MCU.,2.0,2021-10,29,"act:0.35, but:0.18, films:0.25, in:0.16, is:0.28, mcu:0.22, of:0.12, one:0.17, the:0.49, third:0.37, watch:0.28, worth:0.35"
2021-10-19,"Arguably the best MCU movie, but by far not as good as Raimi's Spider-Man  trilogy and Nolan's Batman trilogy",4.5,2021-10,19,"and:0.14, as:0.51, best:0.22, but:0.21, by:0.33, far:0.44, good:0.24, man:0.33, mcu:0.25, movie:0.14, not:0.26, the:0.12"
2021-10-14,"Of the ten that I have seen so far, The Avengers is one of the poorer Marvel movies. It requires a viewing of all previous Marvel films and even at that, falls short of the other ones. Its characters aren't as likeable, the humour isn't memorable, and it is by far the most confusing; at least of the ones I've seen. I'd say it is forgettable if it didn't appear to be so prominent in the Marvel timeline.",2.5,2021-10,14,"all:0.08, and:0.10, as:0.09, at:0.21, avengers:0.07, be:0.10, by:0.12, characters:0.09, didn:0.14, even:0.12, far:0.33, films:0.11, have:0.10, humour:0.17, if:0.12, in:0.07, is:0.18, isn:0.16, it:0.24, its:0.11, least:0.16, marvel:0.23, memorable:0.16, most:0.12, movies:0.09, of:0.27, one:0.08, other:0.12, previous:0.16, say:0.15, seen:0.28, so:0.21, that:0.14, the:0.34, to:0.06, ve:0.14"
2021-10-05,This was a groundbreaking movie when it first came out and still its one of the best.,5.0,2021-10,5,"and:0.15, best:0.24, came:0.43, first:0.27, it:0.18, its:0.33, movie:0.16, of:0.16, one:0.22, out:0.32, still:0.31, the:0.13, this:0.17, was:0.23, when:0.35"
2021-10-01,"Even with Whedon's taint on the film, it still results a fantastic experience.",4.5,2021-10,1,"even:0.37, experience:0.44, fantastic:0.40, film:0.24, it:0.18, on:0.31, still:0.32, the:0.13, whedon:0.38, with:0.24"
2021-09-28,A fantastic movie and one of the best marvel movies ever made,4.5,2021-09,28,"and:0.18, best:0.29, ever:0.38, fantastic:0.46, made:0.44, marvel:0.27, movie:0.19, movies:0.31, of:0.19, one:0.26, the:0.15"
2021-09-21,"Josh Whedon may not understand how to make a justice league movie, but he knows how to make a marvel movie. The movie have an overall great plot. The cast is as always perfect in their roles. The give us moments and oneliners that are iconic till this day. The action scenes are amazing. All the charectors feel useful and needed, right from brute strengh to a tactical overwiew of the situations the heroes are in.  It's just a must see movie.",5.0,2021-09,21,"action:0.08, all:0.08, always:0.16, amazing:0.10, an:0.09, and:0.10, are:0.30, as:0.10, but:0.08, cast:0.13, day:0.16, feel:0.15, from:0.11, give:0.15, great:0.08, have:0.10, he:0.13, heroes:0.11, how:0.24, iconic:0.16, in:0.15, is:0.06, it:0.06, just:0.11, make:0.26, marvel:0.08, may:0.17, moments:0.15, movie:0.22, must:0.14, not:0.10, of:0.06, overall:0.14, perfect:0.13, plot:0.13, right:0.15, roles:0.18, scenes:0.13, see:0.12, that:0.07, the:0.31, their:0.12, this:0.06, to:0.19, understand:0.17, us:0.15, whedon:0.13"
2021-09-19,"The 2nd best MCU film. Filled with likable characters, Joss Whedon really directed a great movie here (I wish I could say the same for Josstice League), and the best of Phase 1. Highly rewatchable, and great performances really elevate this movie. 10/10",5.0,2021-09,19,"10:0.38, and:0.15, best:0.24, characters:0.13, could:0.19, filled:0.25, film:0.12, for:0.11, great:0.23, here:0.24, highly:0.26, joss:0.19, mcu:0.14, movie:0.16, of:0.08, performances:0.22, phase:0.19, really:0.31, same:0.22, say:0.21, the:0.19, this:0.09, whedon:0.19, with:0.12"
2021-09-17,"Avengers is an absolute blast. Exhilarating action, great characters and a witty script makes The Avengers pure fun from start to finish. RDJ as iron man as usual he owns this role. Sam Jackson as nick fury kills it here as well, and all of the cast bring their A game. The Direction from Whedon is stellar and he really does a great job in bringing together this whole cast and the action sequences are filmed really well too. Overall this is my favorite out of Phase 1 MCU The avengers is a really fun time from start to finish and makes it a must watch for comic book fans. Grade A-",4.0,2021-09,17,"action:0.12, all:0.06, an:0.07, and:0.19, are:0.07, as:0.28, avengers:0.16, book:0.09, bring:0.12, bringing:0.11, cast:0.19, characters:0.07, comic:0.09, direction:0.13, does:0.11, fans:0.11, favorite:0.09, finish:0.24, for:0.06, from:0.23, fun:0.16, fury:0.12, great:0.12, he:0.20, here:0.12, in:0.05, iron:0.09, is:0.18, it:0.09, jackson:0.13, job:0.11, makes:0.21, man:0.09, mcu:0.07, must:0.11, my:0.08, nick:0.12, of:0.08, out:0.08, overall:0.10, phase:0.10, pure:0.13, really:0.24, script:0.11, sequences:0.12, start:0.20, the:0.16, their:0.09, this:0.13, time:0.07, to:0.09, together:0.07, too:0.09, watch:0.09, well:0.16, whedon:0.09, whole:0.12"
2021-09-13,"Where it all began, Marvel's The Avengers did what no other movie dared to do, having a large ensemble of heroes, a lovable villain and having an at the time original arc of having the team learn to work together. It's your average run of the mill blockbuster, but a hell of a one at that! Without a doubt this movie's greatest achievement is its all star cast and the chemistry they share, from the charismatic Robert Downey Jr, to the stoic and comedic Samuel L. Jackson, every cast member is perfect in their respective roles and the way they bounce off of each other is just remarkable! The VFX are also outstanding, most of them have aged rather well. This movie does have one glaring problem however, and that is the middle act. It's nowhere near as enjoyable as the other two, its incredibly slowly paced, and doesn't impact the plot is almost any way. All in All, Marvel's The Avengers is just phenomenal in every way. All you can do is marvel at this work of art.",4.0,2021-09,13,"act:0.09, all:0.22, almost:0.09, also:0.07, an:0.05, and:0.17, any:0.08, are:0.06, as:0.11, at:0.18, avengers:0.08, blockbuster:0.08, but:0.05, can:0.06, cast:0.14, chemistry:0.08, did:0.08, do:0.15, does:0.08, doesn:0.09, downey:0.09, each:0.07, enjoyable:0.09, ensemble:0.09, every:0.15, from:0.06, greatest:0.08, have:0.12, having:0.27, heroes:0.06, however:0.09, in:0.12, is:0.24, it:0.10, its:0.13, jackson:0.10, jr:0.09, just:0.12, marvel:0.13, most:0.07, movie:0.09, no:0.07, of:0.22, off:0.07, one:0.09, original:0.09, other:0.21, perfect:0.07, plot:0.07, robert:0.09, roles:0.10, star:0.09, team:0.06, that:0.08, the:0.32, their:0.07, them:0.07, they:0.12, this:0.10, time:0.05, to:0.10, together:0.06, two:0.09, villain:0.07, way:0.19, well:0.06, what:0.06, where:0.09, without:0.09, work:0.15, you:0.06, your:0.09"
2021-09-08,THIS movie was seriously something else some awesome scenes i  love how you get a taste of evryone vs everyone for a brief moment awesome movie 10/10,5.0,2021-09,8,"10:0.45, awesome:0.41, else:0.29, everyone:0.23, for:0.13, get:0.23, how:0.20, love:0.20, moment:0.28, movie:0.19, of:0.09, scenes:0.21, some:0.20, something:0.25, this:0.10, was:0.14, you:0.17"
2021-08-31,"Entertaining but there's absolutely nothing about these Marvel movies that puts them above and beyond. They are all over budgeted, over acted, over PRODUCED, and just worn out.. Marvel is nothing but clichés in cash grabs anymore— GET ORIGINAL.. I wonder who wins in the end?? Robert Downey Jr, please come back to real movies, you're so much better than this crap.",2.5,2021-08,31,"about:0.13, absolutely:0.16, all:0.08, and:0.11, are:0.11, back:0.15, better:0.13, but:0.17, come:0.14, downey:0.16, end:0.14, entertaining:0.14, get:0.14, in:0.15, is:0.06, jr:0.16, just:0.11, marvel:0.17, movies:0.19, much:0.13, nothing:0.33, original:0.17, out:0.12, over:0.48, re:0.17, real:0.17, robert:0.16, so:0.11, than:0.13, that:0.08, the:0.05, them:0.13, there:0.12, these:0.13, they:0.11, this:0.06, to:0.07, who:0.14, you:0.11"
2021-08-30,"Overrated. The gathering of everyone and action are breathtaking for the time, but the plot is too mainstream. Loki is definitely not as well-executed as in Thor. The pacing is unbelievably off, with both the slow parts and the battle taking way too long.",4.0,2021-08,30,"action:0.11, and:0.14, are:0.14, as:0.27, battle:0.19, both:0.24, but:0.11, definitely:0.19, everyone:0.19, for:0.10, in:0.10, is:0.25, loki:0.15, long:0.21, not:0.13, of:0.08, off:0.18, overrated:0.23, plot:0.17, slow:0.23, the:0.36, thor:0.18, time:0.13, too:0.34, way:0.16, well:0.15, with:0.11"
2021-08-29,"Very good movie, but also very corny.",3.5,2021-08,29,"also:0.46, but:0.28, good:0.32, movie:0.19, very:0.76"
2021-08-25,"In this epic culmination to the five films prior, you get everything from thrilling action to interesting character development. Easily, one of the greatest Marvel films of all time.",4.0,2021-08,25,"action:0.14, all:0.13, character:0.19, culmination:0.28, development:0.27, epic:0.23, everything:0.23, films:0.39, five:0.30, from:0.18, get:0.23, greatest:0.24, in:0.12, interesting:0.26, marvel:0.14, of:0.19, one:0.13, the:0.15, this:0.10, time:0.16, to:0.21, you:0.17"
2021-08-25,That was fun. I enjoy Marvel's ensemble stuff the most,4.0,2021-08,25,"enjoy:0.53, ensemble:0.49, fun:0.35, marvel:0.25, most:0.39, that:0.23, the:0.14, was:0.26"
2021-08-25,"#6/25
Best Moment: The novelty of meeting each other",4.5,2021-08,25,"best:0.32, each:0.46, moment:0.62, of:0.21, other:0.47, the:0.16"
2021-08-24,Great action and a strong story about a team coming together and Tom Hiddleston coming into his own as Loki making this one the best films in the MCU.,4.0,2021-08,24,"about:0.19, action:0.12, and:0.16, as:0.15, best:0.13, coming:0.55, films:0.17, great:0.12, hiddleston:0.23, his:0.21, in:0.11, into:0.20, loki:0.16, making:0.23, mcu:0.14, one:0.12, own:0.23, story:0.17, strong:0.25, team:0.16, the:0.13, this:0.09, together:0.15, tom:0.24"
2021-08-23,*Avengers Theme Intensifies*,5.0,2021-08,23,"avengers:0.37, theme:0.93"
2021-08-09,"80/100 GOOD movie, a Classic",4.0,2021-08,9,"classic:0.80, good:0.52, movie:0.31"
2021-07-26,"An incredible film that has all aspects it needs to create a fantastic superhero team that compels you right from the beginning and till the end of the film. It has a basic yet smart plot with surprising scenes and ideas along with one of the best soundtracks, character connections and breathtaking sequences that seem hard to bring all in 2 hours, but this film does an incredible job in entertaining you from the story, comedy and action for the entire runtime",4.0,2021-07,26,"action:0.08, all:0.15, along:0.16, an:0.18, and:0.20, beginning:0.16, best:0.08, bring:0.15, but:0.08, character:0.11, comedy:0.15, does:0.14, end:0.13, entertaining:0.13, entire:0.15, fantastic:0.13, film:0.23, for:0.07, from:0.20, hard:0.16, has:0.21, in:0.14, incredible:0.28, it:0.12, job:0.15, needs:0.17, of:0.11, one:0.07, plot:0.12, right:0.15, scenes:0.12, sequences:0.15, smart:0.17, story:0.11, superhero:0.09, team:0.10, that:0.21, the:0.25, this:0.06, to:0.12, with:0.16, yet:0.17, you:0.19"
2021-07-26,"It was great to see Marvel bring back the original Avengers.  The movie was extra good in special effects especially the Flying Aircraft carrier. The only characters I never cared for was Hawkeye from Marvel and Green Arrow from DC, the reason why, no matter how many times they both shoot arrows, it appears as if the Arrows on their backs are always full!",4.5,2021-07,26,"always:0.18, and:0.06, are:0.12, as:0.11, avengers:0.08, back:0.17, both:0.20, bring:0.18, characters:0.10, effects:0.16, especially:0.18, for:0.09, from:0.24, full:0.19, good:0.10, great:0.09, hawkeye:0.18, how:0.14, if:0.14, in:0.08, it:0.14, many:0.16, marvel:0.18, movie:0.06, never:0.16, no:0.15, on:0.12, only:0.15, original:0.18, reason:0.20, see:0.13, special:0.17, the:0.30, their:0.13, they:0.12, times:0.17, to:0.07, was:0.28, why:0.19"
