date,review,score
"Apr 22, 2022","I can't give this a perfect 5 out of 5.  Besides the heavy lifting scenes of Robert Downey's Iron Man, and before we get the best rendition of the Incredible Hulk ever put to film in that electric third act?  Pretty mundane and average, to be honest.  Even if ultimately a memorable movie going experience.  At times feels like a TV movie in terms of aesthetics and cinematography.  RDJ drags Whedon's material to a greater sum than its parts.",4.5
"Apr 21, 2022",What a fun movie to see. I have been waiting for decades to see these characters presented so well. This honors the source material and I loved every second.,5
"Apr 18, 2022",A great film to start the Avengers Franchise in MCU,4
"Apr 10, 2022","A thrill ride, this was the superhero movie that unseated Batman Returns as my favorite comic book movie. That same feeling I get from going on a rollercoaster I got from seeing this in theaters. Very fun from start to finish.",4
"Apr 6, 2022",Great movie! The MCU is awesome and it was great to see the Avengers get together for the first time. Loki seemed a bit out of character but I guess they needed to do that in order to make him the actual villain of this movie. I suppose it also helps to have the excuse that the mind stone was manipulating him like it did to the avengers in that one scene.,4
"Apr 3, 2022",An awesome team up movie.,4
"Apr 2, 2022",The first time they Unite. The Avengers beats down everything with great performance and solid story development therefore creating something to watch.,5
"Apr 1, 2022",Great movie that brings the avengers together on the big screen for the first time.,4
"Mar 31, 2022","As a smaller kid, the best movie of my youth",4.5
"Mar 18, 2022","Definitely one of the more cinematic MCU films. The way this film changed the landscape for blockbusters is incredible. This was truly the film that showed what Marvel Studios is capable of. CGI, script, and performances are all tremendously high in quality. Standouts include Ruffalo, Hiddleston, Johansonn and Jackson.",4
"Mar 11, 2022",So boring. Bad CGI. Terrible Plot.,0.5
"Mar 7, 2022",Instant classic. Still my favorite comic book movie of all time. Love this movie.,5
"Mar 7, 2022","This movie still stands out as an amazing film. It is action-packed, hilarious, and entertaining throughout. The first fifteen or so minutes do feel like they are of much lower quality - almost TV quality - than the rest of the film, and some of the actors - I'm looking at your Christ Hemsworth - had not fully found their character yet. That is why it loses half a star for me.

Rating - Great",4.5
"Mar 4, 2022",The movie was ultimately a cliché rolled directly out of a rushed cinematic universe. The magic and creativity of Marvel was gimped into a not-so-funny lackluster movie that eventually led to this. Though the historical impact this movie had in team-up superhero movies is ultimately the longest lasting legacy I am happy this movie paved the way for.,1.5
"Mar 3, 2022","B+ ~ At the time of release, this movie an experience since it was the first time superheroes each with their own solo film came together in one giant film. Re-watching this though, some of the goofier elements get in the way of the story-telling. At times, it feels like every character is a clown and the quips never stop. Still have to give this movie respect for what it achieved and for what it paved the way for.",4
"Mar 3, 2022","This movie is not as good as everyone thinks. Yes, it gets better towards the end but the first hour is really boring. The performances are bad, especially for Tony and Steve.",3
"Feb 23, 2022","This movie did something that had never really been done before, had a nice, but comparatively small build-up to what we have now seen, and was a great kick off to the subsequent MCU phases.",5
"Feb 22, 2022","This may be my favourite stand-alone MCU film. From its interesting characters, threatening villain, hard-hitting action, element of espionage, and of course, heart, ""Captain America: The Winter Soldier"" serves as a more than worth sequel to and for ""The First Avenger"" and a memorable entry into the MCU.",4.5
"Feb 16, 2022",A really good start to the MCU,4.5
"Jan 28, 2022",Just perfect and gorgeous!!!,5
"Jan 27, 2022",My rating for the film is a 8.7/10,4
"Jan 27, 2022","An entertaining spectacle of superhero team-up flick with character drama and quaint quips.

Director Joss Whedon's superhero action-thriller The Avengers (2012) is sure to please all viewers seeking enthralling action, but disappoint the Marvel fans wanting stronger character arcs like the individual hero movies. I loved the thrill of watching all of Marvel's greatest superheroes team up together in one movie. The Avengers surely is a great accomplishment and a thoroughly entertaining one from Iron Man fighting Thor to Black Widow evading The Hulk. The Avengers is nearly all action among the cute character interactions. Iron Man, Captain America, and Thor are all better made movies with stronger character development, stories, writing, and direction. 

Whedon brings Marvel's comic book superheroes to life all for a massive brawl in New York against Loki and some goofy aliens. The action sequences are exciting and well thought out with several memorable moments. I just found Whedon's overall direction messy and lacking real depth for each character. He turns each nuanced superhero from the previous films and turns them into Whedon quip quoting machines. Everything is a punchline or pop culture reference suddenly.

Writers Joss Whedon and Zak Penn focus too much on the comedy and action and forget to give these characters detail, motivation, and nuance. It's all about the one-liner jokes and I think that severely detracted from these otherwise interesting characters. I appreciate that producers Stan Lee and Kevin Feige planned this all out to get The Avengers to assemble in a way that makes sense, but I thought Loki's alien attack narrative is really boring and just an excuse to give The Avengers a horde of faceless enemies to destroy.

Robert Downey Jr. is very funny and charming as Iron Man as he gets to show off his quick thinking and scientific skills. Chris Evans remains a bastion of American patriotism and earnest heroism. Mark Ruffalo takes over for Edward Norton as the inner turmoil of rage that is Bruce Banner. His Hulk is really fearsome with cool action sequences and fun moments like Hulk punching the space whale. Chris Hemsworth's Thor loses his serious god personality and turns more into a joke spouting character, but his hammer and thunder powers are still killer. 

Scarlett Johansson is amazingly nuanced as Black Widow as she outwits every man she encounters and looks drop dead gorgeous as the redhead Natasha Romanoff. Scarlett Johansson's Black Widow is super cool and shines in The Avengers with her clever spy skills and combat prowess. She always feels genuine as Natasha Romanoff. I really do appreciate Scarlett still delivering excellence in dramatic acting as Black Widow, who may be my favorite aspect of The Avengers upon revisiting this beloved blockbuster.

Jeremy Renner gets taken over as Hawkeye, so we don't really get to know him yet. Tom Hiddleston's Loki is both scary and entertaining with his hateful smirks and cruel jests. Samuel L. Jackson is actually tough and commanding as S.H.I.E.L.D. Director Nick Fury. Cobie Smulders just appears as Agent Maria Hill, but she's fairly engaging. Clark Gregg gets quite the emotional farewell as Agent Phil Coulson. Stellan Skarsgård is wasted as Loki's science plot device. Gwyneth Paltrow is charming alongside Robert Downey Jr. I wish we got more time with her endearing Pepper Potts. 

Editors Jeffrey Ford and Lisa Lassek cut neatly around the fights, but it can all get lost in how chaotic the action sequences get. Seamus McGarvey has some inspired medium and close-up shots of each hero and them fighting alongside one another, but his wide shots are often really dull to look at compared to the more intimate spaces. The CGI is fine, but has moments that look pretty ugly, especially with all the washed out colors in every scene. Composer Alan Silvestri created an instantly iconic theme song for The Avengers. I really love Soundgarden's end credits song ""Live to Rise"" also!

In all, The Avengers is a very fun movie, that could have been much better honestly.",5
"Jan 24, 2022","Loud, tedious, mind-numbing, cartoony. Each superhero had their moment, and I liked the giant flying spiney machine dragon things in the final act, but overall I found The Avengers difficult to follow and the characters unrelatable. Not bad, but overrated.",2.5
"Jan 19, 2022","A great movie that does the modern superhero movie justice, staying true to its comic material with well written characters and story whilst providing extremely well done action scenes that feel grand in scale much like the stories created by Jack Kirby and Stan Lee",4
"Jan 15, 2022",The Avengers was a great way to combine all of the hard work that marvel studios have done. The character development is such a driving factor for this movie.,5
"Jan 14, 2022","You have no idea how INSANE it was seeing all of the movies and stories that came before it in the MCU tie together. There were definitely better movies, but still really good!",4
"Jan 11, 2022",Epic full of action and chatacters that everyone love.,4.5
"Jan 10, 2022",A bit messy at times but still an enjoyable marvel movie,3.5
"Jan 6, 2022",A classic and still holds up so well to this day.,4.5
"Jan 6, 2022","There is not a single superheroe movie with more epic moments than this one, of course there have been bigger blockbusters, but The Avengers makes us connect with the human side of our favorite heroes in such a compelling way that is easy to see why the movie was and continue to be so acclamed.",5
"Jan 2, 2022","Somehow a group of less-than-stellar films were then funneled chronologically into a team-up superhero film that broke records and our minds. Besides that, with a clever script and exciting action scenes, what seems like a short ride of a story ends up being fairly impressive. At its lowest, Avengers is still fairly decent.",4
"Dec 30, 2021",It was a very enjoyable series,4.5
"Dec 29, 2021",1 of the best movies,5
"Dec 28, 2021",O melhor filme dos vingadores de todos,5
"Dec 28, 2021","One of my favourite MCU movies was so awesome to see all the hero’s at the time come together even tho some don’t even like each other but come together for the greater good. The score and story was really well done it could’ve been really bad and is easy to mess up with so many characters but I felt everything felt fluent and natural, Tom Hiddleston really shines as does Robert Downey JR",4.5
"Dec 23, 2021",Brilliant set up for a brilliant franchise. Directed fantastically.,4
"Dec 22, 2021","Amazing! 

With this all-star cast, there's nothing that can go wrong.

Avengers, Assemble!!",4.5
"Dec 20, 2021",A dream come true for fans now it is a part of cinematic history,5
"Dec 16, 2021","Marvels The Avengers was a movie most comic book fans never thought would occur, and not only did it occur, but it lived up to all the expectations it had on its shoulders. This is a movie that needs to be watched, it is easily still one of my top favorite marvel movies, and it holds up to this day as a great film. While the plot itself is simple, the characters and actions scenes within this movie hold it together and make it a fun movie to watch, even with its dialogue heavy middle. This is a must watch again with Avengers Endgame coming up, as it is the first time these characters were brought together on the big screen. With its importance there, and Endgame being the final send off for Infinity Saga, I would be very surprised if this movie isn't heavily referenced at some point within the film. Go back and watch this film, you won't be disappointed.",5
"Dec 14, 2021","First time watching this one in years and it's still a lot of fun.  It was particularly fun seeing all these characters meet each other for the first time, and seeing Loki back when he was a straight villain.  Probably third in the running for Avengers movie behind Infinity War and Endgame, while miles ahead of Avengers 2.",3.5
"Dec 14, 2021",PERFECT!!! MY FAVORITE MOVIE MCU.,5
"Dec 11, 2021","Fucking awesome, a fantastic conclusion to Phase 1. 5/5",5
"Dec 3, 2021","The script emphasizes its heroes humanity this lived up to its hype and, in my opinion, took the entire franchise to a new height.  The character development and dialogue were much appreciated.",4.5
"Nov 29, 2021",Great Movie And Still remains one of the best MCU movies to date,5
"Nov 22, 2021","Best superhero movie.
Ever.",5
"Nov 20, 2021",Best Marvel movie of all time.,5
"Nov 19, 2021",una pelicula que sin duda marco un antes y un despues en el mundo de los superheroes en general....una de las mejores producciones de superheroes de todos los tiempos,5
"Nov 15, 2021","One of the better installments of the MCU, ""The Avengers"" was a groundbreaking film that changed cinema forever by bringing together these different heroes for the first time. The entire film from start to finish is a blast and an enjoyment to watch, with very memorable lines and a strong performance from its entire cast. The comedy and banter in this movie lands, and the action, especially in the finale, in done very well.",4.5
"Nov 13, 2021","I think we all know how much this movie meant for all the marvel fans and it was truly a new experience. It was great watching the line up between these superhero's and how they work together as a team. The only thing that is bad about this movie are the too many jokes, every 5 minutes comes a joke and it really takes it off a bit.",3.5
"Nov 12, 2021",Molto molto molto bello,5
"Nov 11, 2021","In my top 3 MCU movies, the Avengers is witty, tightly-paced, sharp and gripping from start to finish. Balances multiple headliner superheroes deftly in a single movie, all of the heroes being likable, unlike in ""Justice League"". Could not commend any higher.",5
"Nov 11, 2021",It's the first trial of team-up by the studio and it turned out to be a classic one. Really like this film.,4
"Oct 29, 2021",The pacing is incredibly dull but the third act is worth the watch. Arguably one of the weakest films in the MCU.,2
"Oct 19, 2021","Arguably the best MCU movie, but by far not as good as Raimi's Spider-Man  trilogy and Nolan's Batman trilogy",4.5
"Oct 14, 2021","Of the ten that I have seen so far, The Avengers is one of the poorer Marvel movies. It requires a viewing of all previous Marvel films and even at that, falls short of the other ones. Its characters aren't as likeable, the humour isn't memorable, and it is by far the most confusing; at least of the ones I've seen. I'd say it is forgettable if it didn't appear to be so prominent in the Marvel timeline.",2.5
"Oct 11, 2021",Just...no. None of these Marvel movies are any good.,0.5
"Oct 5, 2021",This was a groundbreaking movie when it first came out and still its one of the best.,5
"Oct 1, 2021","Even with Whedon's taint on the film, it still results a fantastic experience.",4.5
"Sep 28, 2021",A fantastic movie and one of the best marvel movies ever made,4.5
"Sep 21, 2021","Josh Whedon may not understand how to make a justice league movie, but he knows how to make a marvel movie. The movie have an overall great plot. The cast is as always perfect in their roles. The give us moments and oneliners that are iconic till this day. The action scenes are amazing. All the charectors feel useful and needed, right from brute strengh to a tactical overwiew of the situations the heroes are in.  It's just a must see movie.",5
"Sep 19, 2021","The 2nd best MCU film. Filled with likable characters, Joss Whedon really directed a great movie here (I wish I could say the same for Josstice League), and the best of Phase 1. Highly rewatchable, and great performances really elevate this movie. 10/10",5
"Sep 17, 2021","Avengers is an absolute blast. Exhilarating action, great characters and a witty script makes The Avengers pure fun from start to finish. RDJ as iron man as usual he owns this role. Sam Jackson as nick fury kills it here as well, and all of the cast bring their A game. The Direction from Whedon is stellar and he really does a great job in bringing together this whole cast and the action sequences are filmed really well too. Overall this is my favorite out of Phase 1 MCU The avengers is a really fun time from start to finish and makes it a must watch for comic book fans. Grade A-",4
"Sep 13, 2021","Where it all began, Marvel's The Avengers did what no other movie dared to do, having a large ensemble of heroes, a lovable villain and having an at the time original arc of having the team learn to work together. It's your average run of the mill blockbuster, but a hell of a one at that! Without a doubt this movie's greatest achievement is its all star cast and the chemistry they share, from the charismatic Robert Downey Jr, to the stoic and comedic Samuel L. Jackson, every cast member is perfect in their respective roles and the way they bounce off of each other is just remarkable! The VFX are also outstanding, most of them have aged rather well. This movie does have one glaring problem however, and that is the middle act. It's nowhere near as enjoyable as the other two, its incredibly slowly paced, and doesn't impact the plot is almost any way. All in All, Marvel's The Avengers is just phenomenal in every way. All you can do is marvel at this work of art.",4
"Sep 8, 2021",THIS movie was seriously something else some awesome scenes i  love how you get a taste of evryone vs everyone for a brief moment awesome movie 10/10,5
"Aug 31, 2021","Entertaining but there's absolutely nothing about these Marvel movies that puts them above and beyond. They are all over budgeted, over acted, over PRODUCED, and just worn out.. Marvel is nothing but clichés in cash grabs anymore— GET ORIGINAL.. I wonder who wins in the end?? Robert Downey Jr, please come back to real movies, you're so much better than this crap.",2.5
"Aug 30, 2021","Overrated. The gathering of everyone and action are breathtaking for the time, but the plot is too mainstream. Loki is definitely not as well-executed as in Thor. The pacing is unbelievably off, with both the slow parts and the battle taking way too long.",4
"Aug 29, 2021","Very good movie, but also very corny.",3.5
"Aug 25, 2021","In this epic culmination to the five films prior, you get everything from thrilling action to interesting character development. Easily, one of the greatest Marvel films of all time.",4
"Aug 25, 2021",That was fun. I enjoy Marvel's ensemble stuff the most,4
"Aug 25, 2021","#6/25
Best Moment: The novelty of meeting each other",4.5
"Aug 24, 2021",Great action and a strong story about a team coming together and Tom Hiddleston coming into his own as Loki making this one the best films in the MCU.,4
"Aug 23, 2021",*Avengers Theme Intensifies*,5
"Aug 9, 2021","80/100 GOOD movie, a Classic",4
"Jul 26, 2021","An incredible film that has all aspects it needs to create a fantastic superhero team that compels you right from the beginning and till the end of the film. It has a basic yet smart plot with surprising scenes and ideas along with one of the best soundtracks, character connections and breathtaking sequences that seem hard to bring all in 2 hours, but this film does an incredible job in entertaining you from the story, comedy and action for the entire runtime",4
"Jul 26, 2021","It was great to see Marvel bring back the original Avengers.  The movie was extra good in special effects especially the Flying Aircraft carrier. The only characters I never cared for was Hawkeye from Marvel and Green Arrow from DC, the reason why, no matter how many times they both shoot arrows, it appears as if the Arrows on their backs are always full!",4.5
"Jul 23, 2021",Smiled the entire time in the theatre.  Launched the MCU into a level it never came down from.,5
"Jul 19, 2021","The Avengers is a movie that could've easily been a mess and turned out to be a masterpiece thanks to Joss Whedon. The movie nicely culminates the five ones that came before it in the MCU and gives all of the Avengers moments to shine. The action is fantastic, the visuals raise the bar for future MCU films, and the movie ends on a high and satisfying note that leaves plenty of room for future character development and storytelling. The script gives each of the Avengers moments to show us who they are and how they fit into this broader universe. Loki is a great villain for this film due to him being a familiar face and having a direct connection to one of the Avengers, and Tom Hiddleston again gives a strong performance as the character, which is all bolstered by the script giving him a few moments to shine and one-liners as well. The acting in general is good, with both new and familiar faces doing the best they can with their roles. Renner is done a bit dirty in the film, but the big battle redeems that slightly and Renner makes the best of the screen time he has. Unlike some previous MCU movies, this one has lots of rewatch value and will still be entertaining to many on multiple viewings. Overall, The Avengers was a fantastic first culmination for the MCU and set the bar very high for future movies like it.",5
"Jul 18, 2021","One absolute amazing feature film.
Thrill,  Action, intensity,  wit, tech and an evil character that you'll love to hate.",5
"Jul 17, 2021","The movie changes aspect ratios pretty often which can be distracting.
It's a good movie that explores the meeting of the main heroes of the Infinity Saga, but I'll never understand why they all went from hating each other to suddenly fighting together so quickly.",3
"Jul 17, 2021","So a ""Lightening god"" Who takes orders from a man who is  ""extra strong"" and a man in a soup can suit._.How about the indestructible green guy? Oh wait there is a guy with arrows and a girl/Women with a me too hard on.",3.5
"Jul 16, 2021",Electric and also rapidly nostalgic. It doesn't happen that often these days where you're finding yourself wanting more. Sequels usually are the demise of a very good original. This saga gave a lot  and could of done possibly more before it's End.,5
"Jul 16, 2021",This movie came out with a BIG BANG!  Fans loved it and what really can I say about it that hadn't already been said.  Great Movie! Check it out!,5
"Jul 15, 2021","Such a fun movie, maybe not as good as later films, but the characters weren't as developed yet. The one that brought the group together and ""started"" it all though, classic.",5
"Jul 10, 2021","Awesome movie! Love the action. Surprisingly, I never once felt bored throughout the entire thing, even though the final battle is a good half hour or so, and the entire movie is pushing 2.5 hours. Other superhero franchises (if there are any left besides the DCEU) really have something to learn from this movie.",5
"Jul 7, 2021",While a fairly easy to follow and pretty good special effects I couldn't find anything special about this movie. The cinematography is nothing great and just wasn't my thing but great addition if you follow this series and part of me thinks I could have appreciated it more if it was more my thing.,3
"Jul 6, 2021","it is a pretty good movie, loki is a good villain and the first meetings of the avengers are fun to watch",3.5
"Jul 5, 2021",Straight from the comics in many ways. Absolutely brilliant! This movie was a well oiled machine.,5
"Jul 1, 2021",This was good at the time cause no one saw anything as big as this before but its lost its touch,1.5
"Jun 27, 2021","The original avengers movie was very popular and still is. Highly requested after you watch all the movies titled after the “original 6” before 2012. Compared to other MCU movies, this isn’t as good as a couple of them, since the MCU barely miss, and they definitely didn’t miss with this one. This brung one of the most popular marvel characters to this day.",4
"Jun 22, 2021","Marvel (Kevin Feige) did a great job at doing and setting up this movie. They didn't rush into it like Warner Brothers did, they took their time and waited for the perfect opportunity to make and put this movie out. I stand by every decision that was made in this movie, except anything to do with Josh Whedon. Marvel will always hold a dear spot in my heart, and this is one of the movies that I will always think about when I hear Marvel!",4
"Jun 9, 2021","A coming together of individual unique people with mind blowing capabilities, and a good story to tell while not getting too distracted by the eye candy, makes this a spectacular thrill ride you'll want to take again and again! EXCELSIOR!!",5
"Jun 3, 2021","Great movie that brought the avengers and their incredible actors together in a movie with one of marvels top villains, Loki.",5
"May 26, 2021",The Avengers was one of the best movies I've ever seen. The plot was good and interesting. Loki was the perfect villain for this movie. The avengers were put together perfectly. The score of this movie is good. The acting is perfect. There wasn't a single second that I didn't enjoy. All in all i give this movie a 5/5 stars.,5
"May 26, 2021",Hulk was the best part of the whole movie,5
"May 22, 2021",One of the best superhero movies in existance.,4.5
