date,review,score
"Apr 29, 2018",Still great after all these years to see them unite for the first time.,4.5
"Apr 29, 2018","The first avengers movie, brings the classic heroes together, a little better than the sequel.",3
"Apr 29, 2018",One of my favorite Marvel movies.,5
"Apr 28, 2018","It is difficult to underscore how special - epic, funny, and well executed - this movie was, especially for MCU fans. A compelling story and humour made this movie highly enjoyable to behold. And for anyone in love with this universe, it was all our childish dreams made real. Epic. Thank you, Marvel.",5
"Apr 27, 2018","DO NOT TAKE CHILDREN TO THIS MOVIE
I grew up with Marvel and have usually enjoyed their movies...unitl now. This movie is DARK and FULL OF DEATH. There is no happy ending and no heroes that come to the rescue. I can't imagine the impact it has on children who watch as Spiderman becomes fearful of his impending death, and I plan rthe greed of the producers who simply want to have a sequel and make more money. As for me, Marvel is dead in my book.",0.5
"Apr 27, 2018",Excellent “popcorn” Adventure,5
"Apr 26, 2018","A first in superhero movies, a team-up story that triumphs and makes you feel like a kid again when you watch.",4.5
"Apr 26, 2018",Great movie. Full of great characters and an amazing script,4.5
"Apr 25, 2018",Yeh how can you not love this movie. The one and only thing bad about it was Captain America's outfit and even that looked decent when he wasnt wearing the helmet. The way Weadon made these characters react with one enother was briliant. the action scences were spot on cool and Loki is still the Best MCU villian and he just made this movie awsome. The way the story played out so that the heroes didnt originaly come together as a teem but in end knew that the only way to stop the threat on earth was for the group of reemarcible people to come together. this movie was smassing.,4.5
"Apr 25, 2018",An all around AWESOME MOVIE!!!,5
"Apr 25, 2018","pEOPLE ACTUALLY CRIED IN THE THEATER i WAS, QUITE GOOD INDEED.",5
"Apr 24, 2018","This will always have a special place in my heart, loved this movie",5
"Apr 23, 2018",A powerhouse film that brings superheroes to life in a way that could only be imagined in the pages of comic books before it.,4
"Apr 23, 2018","The very first big team up superheroes in a movie like this, and they nailed it, and it still holds up really well 6 years later. The characters have great chemistry and really feel like an actual team, the acting is perfect in every sense of the word, the action is great, and... yeah, theres really not much else I can say. While its almost guaranteed to be surpased by infinity war (which the reason I decided to watch this again is because infinity war is literally right around the corner at the time I'm typing this) its still a great superhero that is absolutely worth watching if you somehow haven't already.",4
"Apr 23, 2018","Strengths: It was always a crazy ambitious plan, but Marvel made the Avengers work in ways nobody could've imagined. Joss Whedon was the perfect person to write and direct this, as he seemed to fully understand what needed to be done. The movie juggles so many vital characters and none ever feel like an afterthought. Robert Downy Jr. (Tony Stark/Iron Man), Chris Evans (Steve Rogers/Captain America), and Chris Hemsworth (Thor) are as great as they always are. Mark Ruffalo (Bruce Banner/Hulk) steps in and provides an upgrade over Edward Norton. Speaking of the Hulk, this was the first movie to truly feel like it understood what the Hulk is supposed to be. He gets to absolutely wreck stuff. Scarlett Johansson (Natasha Romanoff/Black Widow) is honestly kind of a show stealer, while every scene she shares with Jeremy Renner (Clint Barton/Hawkeye) is great. It's the kind of thing that was only put into the MCU during this film, yet worked very well. Tom Hiddleston (Loki) is also a great villain choice, as he and the character have the charisma to line up next to his co-stars. The story has just the right amount of dramatic peaks and valleys. The conflict is not only against Loki and his army, but among the Avengers themselves. Two of the best scenes involve the members arguing on the ship, as well as fighting in the woods. As noted, each character is given ample opportunity to strut their stuff, but the film also makes sure to give the fans what they want. Battles between Cap/Iron Man, Thor/Hulk, Thor's hammer and Cap's shield, etc. were all given attention. The writing is sharp, the dialogue is witty, and there are several laugh out loud moments, making it one of the funniest Marvel films ever. Of course, there's also the action, which is tremendous. There are several huge action sequences that are all perfect for this kind of movie. The final battle against the aliens in New York is grand, breathtaking, and features incredible team ups. 

Weaknesses: I'm sure it sounds weird to say, but I couldn't find any. This is the epitome of what the big blockbuster superhero movie should be. 

Overall: An incredible achievement. They handled so many moving parts with grace and the end result was the greatest superhero movie in history. The action, writing, performances, and way they respected the source material and characters were all done perfectly.",5
"Apr 23, 2018",This is everything that a superhero movie should be. They really struck gold with this one. Then just copied the formula for all the Marvel movies after it.,4.5
"Apr 17, 2018",Best superhero crossover movie ever!,5
"Apr 12, 2018","One of my favorite movies of  all time and one of the best movies, period.",5
"Apr 10, 2018",Dopest Movie!! Fight Scenes are good! Plot were excellent! The only thing I hate is that they killed off Agent Phil Coulson. I which he could've been part of the other MCU moives.,5
"Apr 4, 2018","This was everything we've been waiting to see plus more. Since they rolled out the first Iron Man in 08 they have been building towards this movie this moment and in my opinion it was better then anyone could ever imagine  that it would be, This is the best  comic book movie that is out right now(with the age of Ultron super close to being better).The storyline was great the look of the film can't be touch even though it was most of it was cgi. The action was just outta of hand great.Infinity wars is less then a month away and from the trailer its looks to be good but I will say that the first Avenger set the bar very high.",5
"Apr 3, 2018",This is where we knew that we were just begieing our inrcidable MCU adventure!,4.5
"Apr 2, 2018","What a fantastic movie, from start to finish. What a thrill",5
"Mar 31, 2018",This seemed like a TV movie. I lost all love for Marvel movies because of this. I can't wait for a reboot.,1
"Mar 31, 2018",Excellent. Great action. Great graphics. Great acting!!,5
"Mar 25, 2018","Overall, I loved this film when I first saw it nearly 4 years ago, and love it possibly even more now! It is a brilliant film, and really fives us all a taste of whats next to come in the Marvel Cinematic Universe. Because of this, I am giving the film a 8.5/10.",4
"Mar 24, 2018","A movie with almost no flaws from the great chemistry between all the leads, the story, the villain while also being lighthearted all at the same time. Flawless. 100/100,",5
"Mar 24, 2018",Very interesting and classic actionmovie by marvel. loved it,5
"Mar 23, 2018","An excellent made Marvel film, that will never be forgotten.",4
"Mar 22, 2018","Awesometacular, probably the best superhero movie of all time",5
"Mar 22, 2018",Amazing! This movie is the BEST!!!,5
"Mar 20, 2018",Great Mix of comedy and action that can really make anyone happy,5
"Mar 19, 2018",Great way to finish phase 1!,5
"Mar 17, 2018","Cookie cutter film making at its most mediocre.  Same old same old heroes versus villains who want to take over the world story that's been done over and over again to death.

I guess the dull masses don't mind seeing the same tired story again because this time, OMG, it's the Avengers!!

Aliens attack Earth en masse, but are repelled by a group of 6 exclusively white people, 2 of whom don't even have super powers (or a super suit).  LOL.",2.5
"Mar 16, 2018",An epic and well constructed crossover event.,5
"Mar 13, 2018",Reigns Supreme as the best Marvel movie,5
"Mar 12, 2018",Great superhero film,4
"Mar 11, 2018",I have a soft spot for team-up movies and this one had a lot of good teamwork action scenes. The Hulk and Thor fiasco is fun. Cap is a boy scout. Tony is a dick. Hawkeye and Black Widow are dead weight team members but still cool at times. Loki was an okay villain posing a big threat. It was fun.,3.5
"Mar 10, 2018","I absolutely LOVE this movie!!! My favorite MCU movie to date and tbh, I don’t think any other movie can pass it. It has a great storyline combined with awesome heroes and LOKI!! Need I say more?",5
"Mar 10, 2018",the most unexpected move by marvel. it is so well made and synchronized and the the timing of the movie's release was definitely right.  movie itself can feel overwhelming with the number of characters.,4.5
"Mar 7, 2018",To me the best movie in the world period,5
"Mar 4, 2018","The Avengers is amazing, groundbreaking, mighty Marvel entertainment, and is one of the best superhero films to date",5
"Mar 2, 2018","The Avengers is awesome, funny, action packed, and filled with good humor. The Avengers is awesome!",5
"Mar 2, 2018",i loved it its one of the best superheroes movies marvel has made,5
"Mar 2, 2018",By far the best movie I've ever watched.,5
"Feb 26, 2018","My favorite marvel movie ever, everything about this movie is spectacular (except CGI hulk, Coulson’s fake death, and Nick fury being black (not racist, just not like comics)). Loki is a great villain but I definitely think they should have found a way to make him super powerful cause on his own he can’t beat Thor let alone the avengers, even with a random alien race on his side and a mine controlled scientist who has very little impact on this movie as opposed to the first two Thor movies",4.5
"Feb 24, 2018",Always will remember the first time I saw it in theaters will always find a place in my heart.,5
"Feb 21, 2018","An impressive screenplay allows the audience to become completely invested with characters that are given the right amount of time to be developed. However, despite the blisteringly entertaining action and impressive effects, I don't understand why people believe Loki is such a great villain. He's good for sure, but not the best the MCU has to offer. Doesn't change that this film is about as good as the MCU gets.

A",4.5
"Feb 19, 2018","Do I even need to say anything besides; ""pure fun""?",5
"Feb 17, 2018","Bringing together earth's mightiest heroes into one movie was almost guaranteed to be a smash success, and The Avengers manages to succeed on every level imaginable
 I'll give it 
         - 93%",4.5
"Feb 17, 2018",Una de las mejores películas de superhéroes tiene buenos efectos especiales un gran villano y muy importante un guion que no aburre,4.5
"Feb 16, 2018",This seriously is one of the greatest superhero films ever made.,5
"Feb 15, 2018","One of Marvels Best flims! Amazing Script. Amazing cast and its superheros set pieces, This is a Amazing Unite Avengers Flim",5
"Feb 14, 2018","Considered a modern classic by many, 'The Avengers' might be the most important comic book movie to date, and it's surely gained the love it's been receiving since its release date back in 2012. The cast is perfect, the plot is exciting and the overall feeling of the movie couldn't be more satisfying. It is Marvel's biggest piece of art. Amazing.",5
"Feb 14, 2018",The best superhero film I have ever seen! Delivers without fail on all fronts. ✓,5
"Feb 12, 2018",all time best superhero movie.,5
"Feb 12, 2018","Despite some arbitrary plot points and a slow start, ""The Avengers"" is a creative, exciting, fun film that was definitely worth the wait.",4.5
"Feb 12, 2018",A revolutionary film that set the standard for superhero films after it. It's excellent story only adds more to these pre-developed characters and entertains nerds and non-nerds alike. It aslo has one of the best villains proving that marvel can have good villains if they try.,5
"Feb 11, 2018","The team up of all the marvel heroes that we have been waiting for. In a move that I didn't think would work actually did. All these characters and egos working together seamlessly. Sure, there are flaws and plot holes, but they still work out to make an enjoyable movie going experience. With the Iron man leading up a team of reluctant heroes in order to save the world from Loki and his band of mindless minions. The three main heroes, Iron man, Captain America, and Thor, all shine through. The real surprise though is Hulk. Mark Ruffalo calls in a memorable performance to bring a smile to any comic book fan. His one liners and erratic behavior makes to an enjoyable performance. The one that is held back by the crowded lineup is Hawkeye. Set to be a mindless drone that does Loki's bidding for a majority of the film. This is a real waste of the talent of Jeremy Renner. The man can act with the best of them and he is assigned to a role that is forgettable. The directing style of Joss Whedon is felt for sure. His mannerisms and comedy is felt throughout this film. It feels like Firefly mixed with Buffy. Whitty dialogue mixed with great action set pieces. A must see.",3.5
"Feb 10, 2018","One of the greatest superhero movies ever made. This film is undeniably beautiful, from the intriguing villain to the iconic assembly of The Avengers. The music is great with on point acting and a fantastic story. One of the strongest MCU movies, a well deserved 94%.",4.5
"Feb 6, 2018",the best thing i have ever seen,5
"Feb 6, 2018","Title: Avengers
Story/Writing/Message/Plot:	3
Character/Acting:		3
Music/Sound:			1
Cinematography/Editing:	4
Age/Originality:			4
Total:			15/25",3
"Feb 4, 2018","nice cast, nice plot, and overall kind of a funny version of the classic superhero team",4
"Feb 3, 2018",One Of My Favorite MCU Movies,5
"Feb 3, 2018","This is the best of the Avengers movies.  The story is excellent (Joss Whedon), and the acting is top-tier from everyone in the movie.",4.5
"Feb 3, 2018","Simply one of the best super hero films of all time.  Must watch action adventure, no one does it better then Marvel Avengers.",5
"Feb 2, 2018",Rubbish. Who cares fight with gods,0.5
"Feb 1, 2018",A great beginning story for a team of characters with a great story and amazing actors,5
"Jan 26, 2018","Love, love, LOVE!! Great story, awesome characters and actors, and Loki.. need I say more?",5
"Jan 26, 2018","After some of Marvel's previous movie attempts were big set ups for this movie, Marvel defies all expectations of people saying ""no way a superhero team-up movie could be successful and become the fifth highest grossing movie of all time"". Well they proved the haters wrong and this movie is what turned Marvel into one of the most recognisable studios today. ""Marvel's The Avengers"" is a movie that succeeds in all ways.",4.5
"Jan 24, 2018",Probably the best superhero movie I've seen to this day. I still get goosebumps from the new york fight scene.,5
"Jan 21, 2018","Maybe I gotta watch this again, but I literally couldn't keep my attention on this movie.  Cast seemed good, then I don't know what happened.",0.5
"Jan 20, 2018","This was the movie to either make the MCU or destroy it. If this was bad the MCU would be finished but if it was good we would be provided movie after movie. Thankfully it was the latter. This was a great movie. The movies before it were not the best. In fact the only truly great one was Iron Man. The Incredible Hulk, Iron Man 2 and Thor just kind of failed. Captain America First Avenger was good but not great. The Avengers was even better than Iron Man, thankfully. It seemed that Kevin Feige finally understood not to overstuff the movie. In this movie there are many different superheroes on the screen at a time but it never feels overstuffed with plot like Iron Man 2. Sure everyone is dealing with something but it never makes the main plot feel insignificant. Also, unlike most of the MCU movies before it this movie has a good villain. It brings back Loki. Also this movie is directed by Joss Whedon who previously directed Firefly and Buffy the Vampire Slayer. He did a great job. The plot of the movie is kind of stupid. Basically there is a giant beam in the sky and The Avengers need to stop it but the movie also is filled with great little moments that make it all better. Robert Downey Jr. as  Iron Man is great again. Chris Evans is good. Fortunately Edward Norton as the Hulk was replaced by Mark Ruffalo. The MCU has done a very good job with replacing actors with even better ones. Mark Ruffalo does a great job. Chris Hemsworth is again alright. Tom Hiddleston as Loki is a great villain who is funny but also psychotic. Scarlett Johansson as Black Widow is a lot better in this movie than in Iron Man 2. Jeremy Renner as Hawkeye actually has more than five lines now, unlike Thor, so I guess he is better but he is still everyone's least favourite Avenger. Samuel L. Jackson is great as Nick Fury. Clark Gregg as Coulson makes for an emotional thrill ride. The whole movie is just amazing. The first act is not great but it gets better very fast. Overall it is a great movie. Thumbs up.",4
"Jan 14, 2018",The avengers are getting ready to work as a team to stop Loki can they do that and save people find out! Just a ok movie,3
"Jan 7, 2018",Best movie I have ever seen.,5
"Jan 5, 2018","As ""beginning of the end"", The Avengers is a powerful start. Less fun than others  maybe, but action packed and amazingly well crafted.",3.5
"Dec 31, 2017",A movie that soars. one of the best marvel movies. and thats saying something.,5
"Dec 29, 2017","This is an amazing film with a future that will strive and never get old, plus its incredible cast makes this movie 5 stars!",5
"Dec 29, 2017","Every MCU film raises the bar, both in terms of action and special effects, and in terms of the probing of what it means to be a human hero.

I like that my grandsons enjoy this, especially because it gives us shared entertainment and occasionally shared topics about what a ""hero"" is.",4.5
"Dec 28, 2017","This is how you make a successful movie franchise, an all star cast of Marvel characters hit the screen in the Avengers and pulls it off brilliantly, this film offers an action packed yet light on its feet, engaging plot, with lots of laughs, and a great ending.  Avengers is one of the best of the Marvel movies and shows how to do superhero actions films the right way.",5
"Dec 28, 2017","There was an idea to bring together a group of remarkable people to see if they could become something more...

The Avengers takes an ambitious concept that beautifully pays off, bringing together some of Marvel's most iconic heroes. Incredible fun and humor throughout. In my opinion, the greatest comic book movie to date.",5
"Dec 25, 2017","First and best assemble up to this point. No, Civil War doesn't exceed this. Not even close. A summer flick done right. I will rave and defend this one forever.",5
"Dec 24, 2017","The 2012 Avengers is probably the best superhero movie ever, with the possible exception of the Dark Knight - really depends on what you want from your superhero movies.  A concept like this shouldn't work, but it does, and is so satisfying.  The interplay between these characters coming together for the first time starts out with them grating against each other, but eventually coming together to work well.  I don't think you could have gotten a better director to pull this behemoth off than Joss Whedon, who is very accustomed to large ensemble casts of very disparate characters.  This was a love letter to the fans, a self-congratulating showcase of an experiment that shouldn't have worked, but worked so well that every other studio is trying to find their own franchise universe, and a flag planted that nerd culture is on top and is planning to stay there for the forseeable future.",5
"Dec 24, 2017",Loki's plan was terrible. The movie was hella fun to watch though. Marvel has this thing with faceless/robot armies... be more creative please.,4.5
"Dec 22, 2017","As an adult I can't say this was very enjoyable, but if you're a parent this might be a great one for the kids. There does seem to be a bit of violence though that may not be suitable, depending on strict your guidelines are.

Couldn't take this film seriously with grown men flying around in capes and costumes, and it seems a bit much for a kids film, so I have to give this a low rating.",0.5
"Dec 22, 2017","a very entertaining popcorn flick for everyone to enjoy! Funny, exciting and plenty of action to keep people coming back for more.",3
"Dec 21, 2017","For bringing in such big name characters from other movies and putting them together, it was pretty well done. There were some odd lines of humour that fell flat. Not crazy about the recasting of Mark Ruffalo as Bruce Banner/Hulk, but a great cast otherwise. Pretty cool actions scenes especially at the climax of the film.",4
"Dec 21, 2017",a great culmination that really pays off.,4
"Dec 20, 2017",This is the movie that proved that the MCU worked. From beginning to end a magnificent thrill ride that proved the worth of the superhero genre.,5
"Dec 20, 2017","I like this movie just fine, but I LOVE the second half of it with a passion. After the first hour of pretty interesting set-up, this movie takes off and never lets up for a minute, making it incredibly entertaining",4
"Dec 19, 2017","After five stand-alone movies, the Marvel Cinematic Universe finally adjoins to have six World War II, Norse mythology, and modern-era superheroes band together to fight alien-looking monsters with an iconic score blaring in the background. In other words, the first superhero crossover movie is finally here. After many movies behind its back, this movie is set to make five times the money. For too many years now, the concept of them banding together was nonexistent. There is no question why that scene of them standing in a circle, loaded up in the heart of New York, ready to fight for humanity was ever so important. If you are not sure why that is so meaningful to the audience of the movie, you may have not seen the post-credit scenes to every film beforehand (particularly Iron Man and Thor) as Samuel L. Jackson recruits members to his team.

Beforehand, it would have been clear not to anticipate the film. But now we can only thank director Joss Whedon for creating such a fun-filled thriller of a summer blockbuster. Whedon had previously been known for creating TV's Buffy the Vampire Slayer and can now claim his right to balance large-scale projects as a coherent piece. Having been trusted by such a project though, he seems to have forgotten the millions of Joker fans counting on him to make this entire film work together and instead saves space for Wizard of Oz, playing cards, and Asgardian family jokes. But the fact this still works makes you only love the film even more.

The amount of millions Hollywood has spent reintroducing these characters in movies may seem unnecessary. It is. Robert Downey Jr.'s character, Iron Man, is basically a billionaire tech-geek who owns an iron suit. Chris Hemsworth's Thor and Chris Evans's Captain America are both super-soldiers from non-modern times who have received the spotlight recently so they don't need stand-alone movies. In fact, the central Avenger who steals the show in this film has actually not been introduced before, at least not with this actor, is Bruce Banner, who has rage issues and turns into a green monster known as the Hulk.

These team members assemble with Scarlett Johansson's Black Widow, an agent for Nick Fury, and Hawkeye, an archer for SHIELD portrayed by Jeremy Renner, who just came off of the smashing success of The Hurt Locker, in order to defeat an Asgardian known as Loki, who has come down to invade Earth. Loki is played by Tom Hiddleston and spends much of the movie demanding humans kneel before him without very dark intentions. It is almost a shame that this is the threat the Avengers are facing against.

As this cast and crew are set into action against this script and threat, a MacGuffin-type power cube which tends to always show up in any sci-fi action movie, The Avengers begins to follow its earlier themes and genres: a buddy-cop comedy. The fighting amongst the members of the Avengers in this film actually turns out to be rather refreshing, turning two-dimensional comic book characters into three-dimensional big-screen superheroes. While the script seems to be weak at times, it wins itself back through these conversational exchanges.

It is the action sequences that truly make this film what it was meant to be, while being easy to follow in the process. In a beautiful scene, SHIELD's helicarrier takes off into the air and in a similarly breathtaking action sequence, it gets destroyed by Loki's forces. They then return in the third act as Manhattan gets wrecked to pieces in an effort for the world to be saved.

The battles won seem reminiscent to our fantasies of superheroes saving us from external threats and avenging our world in outstanding action scenes. The film's title certainly displays avenging. While this is probably not the case, the film gives us a breath of fresh air by choosing to go the old-school light way. The nostalgic route the film chooses gives more heart rather than fear and plays well just at that, granting comic book fans their dreams. Even Hulk is granted heart as well as anger. The audience will feel the same way.",4
