date,review,score
"Feb 6, 2020","+ For better and worse looks like a Saturday morning cartoon. Some really nice overall cinematography, even small scenes or FX heavy scenes look good. Even if it sets the series on a path of a fairly plain visual tone.
+ Also for better and worse has the plot of a Saturday morning cartoon which means it's convoluted and painfully simple at the same time.
+ Effects still hold up. Particularly Iron Man.
+ The way the title card comes in is a stroke of genius.
+ Ruffalo plays a pleasant to watch, snarky, smarmy smart guy who's so angry that he's a dick to everyone. It's a good choice even if he's a bit wrong for the role.
+ Powers booth!
+ Effortless and pleasurable connective tissue in the opening recruitment scenes.
+ Cool de-suiting at stark towers.
+ Stark with Potts is a good combination, great chemistry and I want to see more.
+Coulson nerding out is funny still.
+ There is a plethora of excellent dialogue and refreshing takes on the tropes.
+ All the super fights are excellently choreographed slices of comic book action. No battle fatigue, inventive etc., even in the third act.
+ ""He's adopted?""
+ Science bros.
+ Dialogue really flows well, feels organic, important and full of character layers. The repartee particularly between Tony and Cap feels tense and equal and riveting at times.
+ Good use of aspect ratio. Appropriate.
+ Having to explain the nerd stuff to someone who enjoys it anyway means it hits both ways.
+ Much better than I remember. It has aged well.
+ Good closing shot. 

- Gift and curse of Whedon's dialogue is that sometimes it's brilliant and sometimes it's awfully cringeworthy.
- Some wonky or hacky directing.
- Sort of lame opening chunks before the team assembling.
- I just don't like Sam Jackson unless he's playing Sam Jackson. Here he's not. He's playing sneaky, grumpy Mace Windu in an eyepatch.
- Faceless, generic, blue-blooded fodder enemies.
- Quintessential sky-beam blockbuster third act. 

Early Post-Credits sequence review: 2/5: Thanos' reveal. Christ, I remember not knowing anything about this guy at the time. He looks ropey and doesn't say anything. Hard to love. Hard not to appreciate how much it changed things. 

Actual Post-Credits sequence review: 5/5: Shawarma. Now that's funny. Everone's so knackered, accomplished a great mission together. We've all been there. A good callback. Nonsense, but charming, and I love it. 

Stan Lee as: Old Man that doesn't believe superheroes are in New York. 5/5: Another perfect cameo, slotted in there well amongst newsreel and although it breaks the fourth wall a lot, it's a cheeky one delivered at the right time, the calm after the storm.",4.5
"Feb 6, 2020",Another great film in the MCU,4.5
"Jan 28, 2020",Nothing anyone hasn't said already- just watch it. You won't regret it.,5
"Jan 28, 2020","3rd best MCU film. Still better than Endgame tbh.

9.5/10",5
"Jan 26, 2020",This movie is very fun.,4.5
"Jan 23, 2020","Incredible, just seeing them all together is a dream come true.",5
"Jan 22, 2020","This superhero movie is one of my all time favorites. It's full of action, comedy, and drama. The entire cast and crew did a fantastic job in making this movie. Everyone that starred in this movie were the right people for the characters they played. The story was well laid out and was very interesting. Whether you're a superhero fan or not you will love this movie. It'll blow you away and make you laugh. This is a definite must-see.",5
"Jan 20, 2020","Avengers 1 is an overrated theme park. Theme park is a phrase which means the filmmakers focused more on special effects rather than story, and it made the movie boring and bad. The opening scenes were horrible and were weird. You couldn't understand anything going on. It just happened and it was confusing. Only people who read the comics would understand what happened. Thats not very good if you are trying to get non comic book readers into the superhero genre. The acting was bad except for Iron Man, Thor, and Loki. Chris Evans showed no emotion, Mark Ruffalo played Bruce Banner like an arrogant stressed out idiot, Scarlett Johannson didn't have emotion, and Jeremy Renner played Hawkeye where Hawkeye is very lame. However, Robert Downey Jr. did so good with Iron Man, and I can say the same with Hemsworth and Hiddleston with their roles. The movie was boring, the acting was mediocre, and it was an overrated theme park of a movie.",3
"Jan 17, 2020",Another great marvel movie. Just amazing. Really good to see all the avengers together,5
"Jan 11, 2020","When it came out it was awesome, now compared with the new movies it feels a bit too linear and trivial. Still it's a very important movie for the franchise and a really ambitious and well crafted project that comes to a first end. If you enjoyed the first phase movies sure you will enjoy this one more.",3.5
"Jan 9, 2020","Though a bit corny and flashy, the character interactions, action, and plot all make it incredibly enjoyable.",5
"Jan 8, 2020",The best best up movie that it's time,4
"Jan 6, 2020","With horrible dialogue, shitty visuals, over the top goofiness and terrible detection marvel delivers one of the best MCU movies saved by the amazing acting and an engaging story, 9/10.",4.5
"Jan 3, 2020",This movie is great. Absolute see for you,5
"Jan 1, 2020","If most people were honest with their friends and family, and themselves when discussing this movie they would have to admit: the movie overrated. And it was",2
"Dec 31, 2019",Its a great conclusion to Phase 1 by having 4 popular superheroes in a crossover Marvel movie.,4.5
"Dec 30, 2019","This is one of the best-made MCU films, it took 4 characters who all had introductory movies before, and 2 relatively unknown characters and put them all together in this epic team-up action movie, and Joss Whedon executed this to perfection. I am seriously surprised by how good this movie ended up being, it is funny, the action is amazing, the characters get great development and the script was perfect. This 6 superstar Hollywood actors work so well together and play off of each other as best as they possibly could have, the chemistry is real and you can feel that through the magnificent performances. Mark Ruffalo was amazing as the Hulk and he brought the quiet and shy supergenius persona that compliments the Hulk, he was a very good casting for this film. Robert Downey Jr. is just as good as ever, you really feel the struggle within him starting to pull the team apart and he feels like something should be done and he takes charge of re-uniting the superheroes, I was very pleased with his character in this movie. Chris Evans is very quiet until the third act when he organizes the team and kicks some butt with them, he is so very good in the serious roles that he takes and I loved him in this film as well. Jeremy Renner was underutilized way too much, he is mind-controlled for the first two acts and he does'nt get to do much until the epic final battle, but he gave a decent performance and his relationship with Black Widow was very intriguing, I think that they have a great history that is worth exploring. Speaking of which, Scarlett Johansson really made had her breakout role in this film, she is perfect as Black Widow and is a very strong female role model, I enjoyed her contributions to this film even if though both Hawkeye and she were both not used as much as they could have been. Chris Hemsworth is a very good actor and he never gets enough credit for what he does, but starting with this film, his character starts to get really uninteresting and unbearably dull, his character does things that really don't matter, and they're boring to watch, but this film was only the start of his downfall, he is still pretty good. Samuel L. Jackson was surprisingly very good, his character actually did things that he just talked about before, it was great to see how respected and talented he really is, and Nick Fury has many layers that are discovered quite a bit, I loved his character development in this film. Tom Hiddleston is incredible, he is truly evil and wants to see the world burn, you get to see him setting up and executing his evil plan and you get to see how mad and delusional he really is, but he also can toy with peoples emotions like nobody business which was really investing to watch. Agent Coulsen is a great character and his sacrifice was exactly what the Avengers need as motivation to fight, it was perfect and Clark Gregg was very good. I loved seeing Stellan Skarsgard back from Thor, he is a great actor who I would like to see again in the MCU. All of the action is amazing to watch and it is all very entertaining, I loved seeing Thor and Hulk kick ass together, almost a premonition of their relationship in Ragnarok. This movie never drags, it is constantly throwing new problems at you and it is fun to watch these superheroes learn to work together and save the day, the script was excellent really gave every character depth, I sincerely love what this film did for these characters and how this battle of New York would be a crucial building block for all of these characters futures. I love this film and watch it a lot, it doesn't get boring and the script and character development were close to flawless, this is truly the peak of team-up movies and makes me excited about the future of the MCU.",5
"Dec 30, 2019",Phenomenal film 10/10. That is how you do a team-up movie. I love the chemistry with all the characters. it was slow at first to build up the team up but it was amazing. The action scenes are epic. Very fun to watch.,5
"Dec 29, 2019","i like it, it's good",4
"Dec 24, 2019",Wow what a superheroic team up movie really this movie created a new history,4.5
"Dec 22, 2019",Action packed family fun film!!!,4
"Dec 21, 2019",This movie was amazing. Just like other people I didn't expect this movie to work but it did and it was an amazing few hours,5
"Dec 21, 2019","Finally the MCU culminated into one movie. While campy at times, it was undoubtedly fun and enjoyable in the theatre and still holds up today.",4.5
"Dec 20, 2019","A revolutionary superhero film that has never been done this way. Great action, great villain, and a great cast. One of the top movies of all time in my archives, easily!",5
"Dec 20, 2019",I still get chills when the titular theme plays as the heroes band together for the final battle. It's an epic movie and if you haven't seen it you absolutely should. (A+),5
"Dec 19, 2019","Great movie! finally brings our favorites together for a great action spectacle with thrills, chills, drama, action, heart and powerful story arcs! This was an accomplishment in the cinema.",5
"Dec 19, 2019","The Avengers..
Men Amazing movie Sets the Bar for the mcu
I love how they connected all the Characters together for a big showdown
I really liked the Music in this one
Its Filled with Action
And its a must see for Sure",4
"Dec 19, 2019","The film that launched the MCU into the stratosphere. With fantastic balancing and equal story beats for previously built open well rounded characters.
This spectacle is tightly balanced with moments of levity intwined with awesome battle sequences. Amazing performances and a perfectly balanced story made this film revolutionary.",4.5
"Dec 18, 2019","In my opinion after their friend and ally is murdered by the villian, heroes simply do not go on to deliver extendeddddd playful beat em up scenes for the big baddie and his army of nerdowells who are in the midst of committing genocide.   It is not how storytelling works unless you're going for that Deadpoolesc style take.  

This film was essentially just close ups of every hero as they crack the lamest! one liners since Batman and Robin and smirk into the camera.  Between these close ups we are treated to slapstick comedy faceplants or bro on bro punches between the ""rage filled"" monster companion(the most embarrassing take on the hulk to date) and the god of thunder...... lame.

For the finale the alien army is just straight up insta killed in a single explosion for some reason.  The director/writers never bother to explain how this is even possible or to show the heroes working out a way it could be achieved, in fact they had no idea themselves.  There is no established link between the aliens and some sort of hive mind or central control hub or entity who is connected to them all delivering commands.  No just stark grabs a missle the government shot at New York(despite the portal being in the sky above it) and happens to fly it through the portal and it, by sheer luck, manages to hit a ship we haven't even seen before and BAM!!! planetary scale invasion immediately ended.   Coolcoolcoolcoolcool lets hope no one questions it.  I guess who needs narrative when thor can faceplant a window right xD


Next the mass murderer who stabbed their mate to death in the previous scene is comically interrupted mid temper tantrum(after all his entire motivations for being a villian in the first place is a temper tantrum with his adopted daddy who gave him a better life than he could ever of had otherwise) by the funny ""rage monster"" who leaves him in a ditch and cracks a lame one liner as he strolls off screen""pwunnnwy gwd"" :/.   The camera then zooms in for a close up of the big baddie who in turn, comically sighs with a bemused expression on his face and the heroes grab a quick bite to eat in a nearby half destroyed restaurant.......   if this wasn't the most angsty/edgy villian i have ever seen i dont know what is.


The franchise completely lacks the understanding of how to balance comedy with tragedy and shows no sign of improvement as it continues.  Storytelling takes a back seat to flashy action scenes and poorly timed one liners.  Romance and/or family relationships are barely more than an afterthought, if they are mentioned at all.   It all cumulates in a lack luster movie with 0 emotional developments or story points, disappointing narrative plot holes and an anticlimactic finale.  The characters have to be the most gimmicky collection of 2 dimensional heroes on the big screen in decades.  If it wasn't for their hammer or robot suit or fancy shield you wouldn't be able to tell one character from the other.

Overrated doesn't cut it for this movie how it crossed a billion dollars is, i don't know, the lamest miracle ever? hah",0.5
"Dec 18, 2019",Avengers Assemble? Yes sir.,5
"Dec 17, 2019","It was amazing seeing The Avengers team up for the first time in 2012, The whole thing is EPIC and started My Favorite Franchise of all time. It has amazing character development like all of the MCU, And The amazing Battle of New York.",5
"Dec 10, 2019","Count on the Avengers to make man-tights and capes look more fashionable than ever! With incredible fight choreography, it's hard not to be impressed.",5
"Dec 10, 2019",The incredible mix of superheroes together with their personalities and powers is a guarantee to impress any sort of audience.,4.5
"Dec 10, 2019","If you're a comic book fan like me, you'd understand that usually, superhero storylines adapt a more straight, serious tone, but with the Avengers you have the great storyline of a superhero film and the comedic relief of banter.",4.5
"Dec 10, 2019",I appreciate how they made sure to introduce each character before bringing them together for an epic fight to defend the Earth. It gives much more depth to each superhero.,5
"Dec 10, 2019",Marvel really outdid themselves on this one. This is one of their greatest works to date and only a handful of films can compare to this one - and all of them have mostly been Marvel too!,5
"Dec 9, 2019","The title says it all, you will really MARVEL at the awesomeness of this film. Where else can you find a film with more superheroes than you can imagine working together to save the Earth?",5
"Dec 9, 2019",I'm not exaggerating when I say that this is the best superhero film of all time!,5
"Dec 9, 2019","I gotta admit I was not ready for all that shaky-cam action. I mean, you could clearly see that the choreography for the fight scenes was good enough for a superhero movie, but why did you have to add so much shaking and cutscenes?",5
"Dec 9, 2019",I appreciate how they made sure to introduce each character before bringing them together for an epic fight to defend the Earth. It gives much more depth to each superhero.,5
"Dec 9, 2019",It was a great idea to bring together this group of amazing superheroes and at the same time amazing actors to create a top-class superhero film.,5
"Dec 1, 2019","Iron Man, Captain America, Hulk, Thor, Black Widow and Hawkeye cooperate to defeat the forces of evil in this mightiest movie of 2012! It deserves an A+!",5
"Nov 26, 2019","When you have an amazing team of actors with great chemistry both on and off-screen, a team of directors who are passionate about what they do, and a production crew that's always coming up with new ways to reinvent the superhero genre, then you'll get a successful film like this.",5
"Nov 26, 2019","It takes more than just great actors to make a successful film, so for the people behind the curtains making everything even more awesome, I want to give my thanks for providing us with this masterpiece of a film!",5
"Nov 25, 2019","Awesome superheroes and excellent script as well. For an action-adventure film, the script was extremely detailed and that's what appealed to me the most.",5
"Nov 25, 2019",This is not a good movie... It's a GREAT MOVIE! Filmmakers did an awesome job taking the storyline from the comic books and making sure that most of it were kept.,4.5
"Nov 25, 2019",Stan Lee cameos are the best! It's too bad he won't be around to do that now. It was one of the things I look forward to in each of the Marvel movies,4.5
"Nov 25, 2019",The best thing about this movie is that it gave each superhero their own unique way of contributing to the team. It wasn't just another film wherein there's one superhero that stands out among the rest while the rest got overshadowed by this main character.,5
"Nov 25, 2019","More than just a superhero film, this movie had a definite soul and smart plot as well. It's a guarantee that superhero fans will love it but at the same time, common moviegoers will find it entertaining too.",5
"Nov 25, 2019",Are you a fan of epic adventure movies? Then this is your dream come true! Truly this is the ultimate superhero mash-up and it's executed perfectly. Props to the filmmakers for taking the time to design it to be more than just a superhero film packed with action scenes and adding depth to each character.,5
"Nov 25, 2019",Good fighting sequences but fight sequences felt too crazy and made it quite difficult to fully enjoy the great choreography.,5
"Nov 25, 2019",Kudos to the fight choreographers who designed all the action sequences for this movie. They really did a good one!,5
"Nov 25, 2019","If you haven't seen this film yet, do yourself a favor and remain unspoiled. This is one of the movies that need to be savored.",5
"Nov 25, 2019",The cast really delivered. Sure they were playing the roles of superheroes but you can really see and feel a deeper level of emotions in their performance.,5
"Nov 25, 2019",One of the many things I loved in this film was the conflict between Iron Man and Captain America for leadership and how the two differ in their approach. A veryunique way of building a team of superheroes.,5
"Nov 25, 2019",One word for this movie: AWESOME. It's an amazing film and has everything a superhero fanboy hoped for and more.,4.5
"Nov 25, 2019",I tried my best to avoid getting carried away by the hype of this movie because nowadays most of the movies that are too much hyped end up just being disappointments but I'm glad to say that I WAS NOT DISAPPOINTED when this came out.,5
"Nov 25, 2019","Wow, Coppola and Scorsese were right.",1
"Nov 20, 2019",absolutely bonkers fun superhero action comedy. And a very good villain. kudos to Marvel.,5
"Nov 16, 2019","I loved this movie! I didn't like Phase 1 that much, but this movie was a great way to end off Phase 1.",4
"Nov 8, 2019","When you have a bunch of flashy superheroes fighting supernatural, extraterrestrial villains from another dimension, it can get pretty hard to highlight each of their strengths,  but Marvel pulled it off with this one!",5
"Nov 8, 2019",Wonderful movie to watch if you want to be entertained and not think about the plot too much.,4.5
"Nov 7, 2019",It's clichéd and we love it.,4
"Nov 7, 2019",Perfect casting! You can really see and feel that the actors have great chemistry both in and out of their characters.,4.5
"Nov 7, 2019",I found it creative of Marvel to introduce each character one by one. It really set the tone and had me looking forward to what's gonna happen.,5
"Nov 7, 2019","Definitely the greatest superhero movie of all time. Marvel has set the bar high with this one and so far, they're doing a good job of keeping up with that despite not being able to raise it higher!",5
"Nov 6, 2019","Marvel's The Avengers delivers the purest form of entertainment ever put in a movie, and succeeds at making all of our heroes share the screen in a coherent way.  It truly is a revolutionary outing from Joss Whedon that ignited a new era of crossover comic-book movies.",4.5
"Nov 6, 2019","The Avengers is a dream movie come true for superhero fans with its group of extremely talented actors and epic champions, to create an action- packed movie with hilarious banter laced in between scenes. I love how each of the actors and actresses has portrayed each of the roles they were given.",4.5
"Nov 5, 2019","This movie it's literally a masterpiece, it showed the world that the Avengers are really awesome!!!",5
"Oct 23, 2019",How many movies did it take to come up with this mundane plot ?,0.5
"Oct 23, 2019",#Avengers with the Best of 'Em All #IronMan #TonyStark What More Needs To Be Said.. The Dopest Fliest MF'r there is & The Rest of Marvel Avengers.,5
"Oct 22, 2019","The Avengers had changed the way that superhero ensemble films are made, with a great script from Joss Whedon including his famous quips and also his direction, he knew how he wanted to make the characters stand out. Of course the stand out performance is Robert Downey Jr. (as he is in all MCU films) the only main issue I have with this film is that is does start of slow, which might turn people away, however if your stick with it towards the end, then you get a epic 3rd act, which  at the time was the greatest on screen. So with it being full of action, humour, great superhero set pieces, the Avenegrs is a must see for all superhero fans... you will be converted when you see the greatest group shot along with the music still remains the best ever..... One of the best superhero films ever made off course.",5
"Oct 22, 2019",If I had my hands on this movie it would of been excelsior.,0.5
"Oct 20, 2019","Great movie, great storyline with awesome action",4
"Oct 18, 2019","Its... okay. The loki thing was a bit un needed. I understand how hard finding another enemy for the avengers to fight thats not thanos is, but there could have been a better villan.",3
"Oct 13, 2019",Fantastic start to an amazing series. Love every one of them,4
"Oct 13, 2019",Perfect start to an amazing series.,5
"Oct 9, 2019",Dictionary of a team-up movie.,4.5
"Oct 8, 2019",Es muy entretenida y se puede disfrutar para toda la familia pero hay veces que la trama si aburre.,3.5
"Oct 8, 2019",After years of solo hero movies we finally have the avengers come together to defeat lokey. Amazing to finally see all of our heroes teaming up. And see the direction the MCU is heading in (infinity gauntlet). All in all a great movie with great action. And decent CGI.,4
"Oct 8, 2019","Everyone is saying that and game is the better movie but it's like not even that good.  I mean it's a good sequel but not a good movie. There so many reasons why end game is not good. 1st of all why didn't  Tony just use the eather or reality stone to just cut all the chitari and thanos in half  and why don't they just use the time stone to go back before black widow died and just save her.  But with this movie it's  pure and everything is important they didn't and they couldn't add nothing could of been cut out. Also Robert Downey Jr. Is way better in this movie than he isn't endgame. Loki is also a really good villain he all like shakespearean and of like he talks in metaphors. Like  when Nick fury is like trying to steal the  tesseract and he and Loki have a conversation and when Loki says, "" I will make a world free"" then Nick says, "" free from what?""  ""free of freedom, freedom is the one lie we tell ourselves and once we accept that then you will truly be free."" that I the Nick's like,""We have no quarrel with your people"" he says an ant has no quarrel with a boot,""  "" do you plan on stepping on us?"" And the part where iron man thor and captain America are fighting is just so cool and Thor strikes cap's sheild and the forest basiclly explodes, just go watch the scene it's amazing. Snd also watch the movie.",5
